SKU,Title,"Last Received","30 Days Item Sale",Quantity,"True Cost",D1,P1,"Sale Price","Date Updated",Competitor,"Previous Price",Price
FLX-SAM-1465,"Charging Port Flex Cable for Samsung Galaxy S6 Edge Plus G928P","12/27/17 03:12 PM",0,4,3.96,8.99,7.59,5.89,"07/05/18 11:00 PM",etrade_supply,7.33,7.31
FLX-SAM-1476,"Charging Port Flex Cable for Samsung Galaxy S5 G900F","08/24/17 02:40 PM",0,5,3.58,7.77,6.11,4.49,"07/05/18 11:01 PM",etrade_supply,8.78,8.75
FLX-SAM-1489,"Charging Port Flex Cable for Samsung Galaxy S5 G900H","08/24/17 02:40 PM",0,8,3.88,9.37,7.89,4.99,"07/05/18 11:20 PM",etrade_supply,7.33,7.31
SRN-LGM-677,"LCD and Touch Screen Digitizer with Frame for LG G3 - Gold","05/04/18 03:36 PM",0,3,36.16,59.2213,0,34.39,"07/05/18 11:20 PM",etrade_supply,48.2,48.05
SRN-LGM-681,"LG Optimus G LS970 LCD Screen Touch Screen Digitizer with Frame","12/19/17 03:54 PM",0,2,0,49.99,0,37.49,"07/05/18 11:20 PM",etrade_supply,48.21,48.06
SRN-MOT-422,"Motorola Moto G XT1032 XT1036 LCD Touch Screen Digitizer Assembly","08/22/16 10:30 AM",0,2,24,33.91,31.49,21.49,"07/05/18 11:20 PM",etrade_supply,26.35,26.27
SRN-MOT-426,"LCD Screen and Digitizer Assembly for Motorola Moto E XT1021 XT1022 No Logo Black","10/16/17 03:31 PM",0,1,14.93,20.99,16.09,16.09,"07/05/18 11:20 PM",etrade_supply,23.46,23.39
SRN-MOT-440,"LCD and Touch Screen Digitizer for Motorola Moto E XT1021 XT1022 XT1025 - White",N/A,0,9,0,20.99,0,16.09,"07/05/18 11:20 PM",etrade_supply,19.74,19.68
SRN-MOT-442,"LCD + Touch Screen Digitizer for Motorola Droid Mini XT1030 Black","03/20/18 03:49 PM",0,2,10.17,23.81,21.89,14.69,"07/05/18 11:20 PM",etrade_supply,29.85,29.76
SRN-MOT-456,"LCD + Touch Screen Digitizer with Frame for Motorola Droid Razr M XT907 Black","02/26/16 11:30 AM",0,0,18.02,26.13,23.99,0,"07/05/18 11:20 PM",etrade_supply,24.66,24.58
FLX-SAM-1492,"Charging Port for Samsung Galaxy Tab Pro 8.4 T320 ","06/13/18 01:48 PM",0,5,1.67,4.91,3.69,2.49,"07/05/18 11:20 PM",etrade_supply,3.58,3.57
FLX-SAM-1506,"Charging Port Flex Cable for Samsung Galaxy S5 G900F","03/21/18 03:19 PM",2,1,3,12.99,0,4.49,"07/05/18 11:20 PM",etrade_supply,8.78,8.75
FLX-SAM-1545,"Charging Port for Samsung Galaxy Tab 3 8.0 SM T310 ","04/25/18 04:13 PM",0,5,1.99,8.49,0,2.49,"07/05/18 11:40 PM",etrade_supply,4.97,4.95
FLX-SAM-156,"Keypad Microphone Flex Cable for Samsung Galaxy S",N/A,0,4,0,7.95,5.59,0.99,"07/05/18 11:40 PM",etrade_supply,3.57,3.56
SRN-LGM-575,"LCD + Touch Screen Digitizer with Frame for LG Optimus G2 D800 D801 B29 - Black","02/06/18 10:39 AM",0,0,27.33,59.99,29.99,29.99,"07/05/18 11:40 PM",etrade_supply,41.13,41
SRN-LGM-580,"LG G4 Mini LCD Screen Touch Screen Assembly - Black",N/A,0,2,45.02,61.9,56.29,36.49,"07/05/18 11:40 PM",etrade_supply,28.68,28.59
SRN-LGM-585,"LG G Flex 2 LCD Display and Digitizer Assembly - Black","12/01/16 12:52 PM",0,0,56.42,76.17,69.49,0,"07/05/18 11:40 PM",etrade_supply,66.48,66.28
SRN-LGM-616,"LCD and Touch Screen Digitizer for LG G Vista D631 VS880","09/26/17 02:24 PM",1,2,32.2,49.91,45.38,0,"07/05/18 11:41 PM",etrade_supply,64.28,64.08
SRN-LGM-618,"LCD and Touch Screen Digitizer Replacement for LG Lucid 2 - Black",N/A,0,0,0,69.95,0,0,"07/05/18 11:41 PM",etrade_supply,60.17,59.99
SRN-LGM-636,"LG Optimus G Pro E980 LCD Screen","10/12/16 09:38 AM",0,1,12.86,19.93,17.69,16.99,"07/05/18 11:41 PM",etrade_supply,14.88,14.83
