SKU,Title,"Last Received","30 Days Item Sale",Quantity,"True Cost",D1,P1,"Sale Price","Date Updated",Competitor,"Previous Price",Price
APL-003-1850,"Home Button Flex Cable for iPad Pro 10.5 - Rose Gold","05/15/18 10:50 AM",0,3,3.45,14.99,0,7.59,"12/08/18 06:20 PM",mobile_defenders,5.99,4.99
APL-003-1851,"Home Button Flex Cable for iPad Pro 10.5 - Space Grey","05/15/18 10:50 AM",0,3,3.45,14.99,0,7.59,"12/08/18 06:20 PM",mobile_defenders,5.99,3.99
APL-003-1852,"Home Button Flex Cable for iPad Pro 10.5 - Silver","05/15/18 10:50 AM",0,3,3.45,14.99,0,7.59,"12/08/18 06:20 PM",mobile_defenders,5.99,3.99
APL-003-1639,"LCD Tester for iPhone 6S Plus","07/27/18 04:39 PM",0,10,3.09,94.6,6.59,3.99,"12/08/18 06:41 PM",mobile_sentrix,3.16,3.13
APL-003-1817,"Wifi Antenna for iPhone 8 Plus","10/10/18 04:00 PM",0,6,1.17,15.99,0,8.09,"12/08/18 07:00 PM",mobile_defenders,0.99,1.49
BTY-COV-1597,"Front LCD Frame Housing for Samsung Galaxy Note 5","07/27/18 04:23 PM",1,2,3.98,7.99,5.69,4.99,"12/08/18 07:00 PM",mobile_defenders,4.99,3.99
SRN-HTC-1159,"LCD and Touch Screen Digitizer for Google Pixel - White","05/01/17 01:21 PM",0,0,80.44,119.262,111.01,82.99,"12/08/18 07:20 PM",mobile_defenders,57.99,44.99
SRN-HTC-1160,"LCD and Touch Screen Digitizer for Google Pixel XL - Black (No Logo)","10/30/18 01:37 PM",0,4,63.22,149.99,149.99,88.99,"12/08/18 07:20 PM",mobile_defenders,92.99,69.99
SRN-SNY-146,"LCD and Touch Screen Digitizer with Frame for Sony Xperia XA - Black",N/A,0,0,0,64.99,0,29.99,"12/08/18 07:21 PM",mengtor,16.99,15.99
SRN-SNY-147,"LCD and Touch Screen Digitizer with Frame for Sony Xperia XA - White",N/A,0,0,0,64.99,0,29.99,"12/08/18 07:40 PM",mengtor,16.99,15.99
BTY-COV-1746,"Midframe Bezel for Samsung Galaxy S7 - Gold","10/10/18 04:00 PM",0,3,6.19,19.99,0,10.99,"12/08/18 08:00 PM",mobile_defenders,16.99,9.99
FLX-SAM-1595,"Charging Port with Flex Cable for Samsung Galaxy S9 G960U (USA)","12/04/18 03:51 PM",3,9,5.18,15.99,0,7.39,"12/08/18 08:21 PM",mobile_defenders,9.99,7.99
FLX-SAM-1609,"Charging Port with Flex Cable for Samsung Galaxy S9 Plus G965U (USA)","12/04/18 03:51 PM",3,6,4.74,11.99,0,0,"12/08/18 08:40 PM",mobile_defenders,9.99,7.99
FLX-SAM-1596,"Charging Port with Flex Cable for Samsung Galaxy S9 G960F (International)","08/06/18 11:36 AM",0,2,4.55,15.99,0,7.49,"12/08/18 08:40 PM",mobile_defenders,5.99,2.99
FLX-SAM-1597,"Proximity Sensor Flex Cable for Samsung Galaxy S9/S9 Plus","08/06/18 11:36 AM",0,5,1.57,3.99,0,2.89,"12/08/18 08:40 PM",mobile_defenders,3.99,2.99
FLX-SAM-1598,"Volume Flex Cable for Samsung Galaxy S9","08/06/18 11:36 AM",0,5,2.31,3.49,0,2.99,"12/08/18 09:00 PM",mobile_defenders,2.99,1.99
FLX-SAM-1602,"Rear Camera with Flex Cable for Samsung Galaxy S9","08/06/18 11:36 AM",0,5,16.56,38.99,0,0,"12/08/18 09:00 PM",mobile_defenders,24.99,19.99
FLX-SAM-1603,"Front Camera with Flex Cable for Samsung Galaxy S9","08/06/18 11:36 AM",0,4,2.38,4.99,0,0,"12/08/18 09:00 PM",mobile_defenders,3.99,2.99
FLX-SAM-1604,"Loudspeake Buzzer for Samsung Galaxy S9 - Black","08/06/18 11:36 AM",0,5,6.86,19.99,0,0,"12/08/18 09:00 PM",mobile_defenders,7.99,4.99
FLX-SAM-1605,"Sim Card Tray and MicroSD Card Tray for Samsung Galaxy S9 G960/ S9 Plus G965 - Black","08/06/18 11:36 AM",0,7,0.89,2.49,0,1.99,"12/08/18 09:20 PM",mobile_defenders,1.99,1.49
FLX-SAM-1613,"Volume Flex Cable for Samsung Galaxy S9 Plus","08/06/18 11:36 AM",0,5,1.04,2.99,0,0,"12/08/18 09:20 PM",mobile_defenders,2.99,1.99
FLX-SAM-1615,"Vibrator Motor with Flex Cable for Samsung Galaxy S9 Plus","08/06/18 11:36 AM",0,5,1.04,1.5,0,0,"12/08/18 09:20 PM",mobile_defenders,1.99,0.99
APL-003-1892,"Power Flex Cable With Mic for iPad 5 (2017)","10/18/18 11:57 AM",0,10,1.36,5.99,0,2.99,"12/08/18 10:00 PM",mobile_defenders,2.49,1.99
APL-003-1896,"Audio Flex Cable With Headphone Jack for iPad Air/iPad 5 (2017) - Black","10/18/18 11:57 AM",0,14,1.51,8.99,0,4.19,"12/08/18 10:01 PM",mobile_defenders,2.99,1.99
APL-003-1897,"Audio Flex Cable With Headphone Jack for iPad Air/iPad 5 (2017) - White","05/22/18 12:38 PM",0,5,3.72,8.99,0,4.19,"12/08/18 10:20 PM",mobile_defenders,2.99,1.99
APL-003-1915,"Power Volume Flex Cable for iPhone SE","07/27/18 04:39 PM",3,4,2.34,7.99,0,4.99,"12/08/18 11:00 PM",mobile_defenders,5.99,2.99
SRN-HTC-1161,"LCD and Touch Screen Digitizer for Google Pixel 2 - Black (No Logo)","11/20/18 12:12 PM",1,2,77.78,189.99,0,134.99,"12/08/18 11:20 PM",mobile_defenders,139.99,109.99
BTY-HTC-099,"Battery for Google Pixel 2",N/A,0,0,0,14.99,0,7.89,"12/08/18 11:20 PM",mobile_sentrix,8.06,7.31
SRN-HTC-1162,"LCD and Touch Screen Digitizer for Google Pixel 2 XL - Black","11/13/18 04:48 PM",0,4,104.7,199.99,0,149.99,"12/08/18 11:20 PM",mobile_defenders,149.99,139.99
BTY-HTC-100,"Battery for Google Pixel 2 XL",N/A,0,0,0,17.99,0,9.49,"12/08/18 11:20 PM",mobile_sentrix,9.58,8.53
