SKU,Title,"Last Received","30 Days Item Sale",Quantity,"True Cost",D1,P1,"Sale Price","Date Updated",Competitor,"Previous Price",Price
BT-BP-30158,"BinTEK Battery for iPod Touch 4 980mAH Li-Polymer Premium ","06/30/17 02:35 PM",1,3,3.88,8.99,8.99,4.99,"01/13/19 12:00 AM",etrade_supply,3.81,3.87
BT-BP-30180,"BinTEK Sony XPeria Z L36H 2330mAh Li-Polymer Premium Battery","01/20/17 10:19 AM",0,6,5.19,15.99,15.99,10.99,"01/13/19 12:00 AM",etrade_supply,9.08,9.22
BT-BP-30182,"BINTEK Sony L39h Xperia Z1 C6902 C6903 C6906 3000 mAH Li-Polymer Premium Battery","01/20/17 04:34 PM",1,2,5.33,15.99,15.99,10.99,"01/13/19 12:00 AM",etrade_supply,9.08,9.22
BT-BP-30194,"BinTEK Battery for LG G4 BL-51YF 3000mAH Li-Ion Premium ",N/A,0,-3,6.05,10.59,8.89,3.99,"01/13/19 12:00 AM",etrade_supply,10.88,11.04
BT-BP-30252,"BinTEK HTC One M9 2840mAH Li-Polymer Premium Battery",N/A,0,0,0,13.99,0,8.49,"01/13/19 12:00 AM",etrade_supply,10.93,11.09
BT-BP-30254,"BinTEK Sony Xperia M4 Aqua 2400mAH Li-Polymer Premium Battery",N/A,0,0,0,14.99,0,0,"01/13/19 12:01 AM",etrade_supply,9.08,9.22
BT-BP-30260,"BinTEK Sony Xperia Z3 Compact 2600mAH Li-Polymer Premium Battery",N/A,0,0,0,14.99,0,0,"01/13/19 12:01 AM",etrade_supply,6.93,7.03
BT-BP-30262,"BinTEK Sony Xperia T3 2500mAH Li-Polymer Premium Battery",N/A,0,0,0,9.99,0,0,"01/13/19 12:01 AM",etrade_supply,9.09,9.23
BT-BP-30270,"BinTEK Battery for Samsung Galaxy S4 Mini 1900mAH Li-Polymer Premium ",N/A,0,0,0,14.95,0,9.99,"01/13/19 12:20 AM",etrade_supply,8.94,9.08
BT-BP-30274,"BinTEK HTC Desire 626 2000mAH Li-Polymer Premium Battery",N/A,0,0,0,11.99,0,0,"01/13/19 12:20 AM",etrade_supply,6.93,7.03
BT-BP-30278,"BinTEK HTC Rezound 1620mAH Li-Ion Premium Battery",N/A,0,0,0,9.99,0,0,"01/13/19 12:20 AM",etrade_supply,5.43,5.51
BTY-COV-446,"Rear Housing Frame for Samsung Galaxy S3 i747 - Black","07/18/17 11:51 AM",0,2,3.1,4.95,0,0.99,"01/13/19 12:20 AM",etrade_supply,3.87,3.93
BT-BP-30292,"BinTEK Battery for Samsung Galaxy J7 (2016) 3300mAh Premium ",N/A,0,0,0,18.99,0,10.49,"01/13/19 12:20 AM",etrade_supply,9.52,9.66
BT-BP-30293,"BinTEK Battery for Samsung Galaxy J5 (2016) 3100mAh Premium ",N/A,0,0,0,18.99,0,9.99,"01/13/19 12:20 AM",etrade_supply,9.52,9.66
BTY-COV-106,"HTC Sensation Back Battery Cover","01/05/17 12:04 PM",0,0,5.44,9.126,7.89,6.29,"01/13/19 12:20 AM",etrade_supply,6.54,6.64
BTY-COV-108,"HTC EVO 3D Battery Cover Back Door","03/25/16 11:23 AM",0,0,2.81,6.32,4.69,4.99,"01/13/19 12:21 AM",etrade_supply,5.18,5.26
BTY-COV-112,"Midframe Bezel for Samsung Galaxy S3 i535 R530 -  Blue",N/A,0,39,0,8.95,6.99,0.99,"01/13/19 12:40 AM",etrade_supply,1.72,1.75
BTY-COV-114,"Midframe Bezel for Samsung Galaxy S3 i747 T999 -  Blue","07/21/15 11:30 AM",0,11,2.75,6.1875,4.59,0.99,"01/13/19 12:40 AM",etrade_supply,4.87,4.94
BTY-COV-116,"Midframe Bezel for Samsung Galaxy S3 L710 -  Blue",N/A,0,9,0,7.95,4.99,0.99,"01/13/19 12:40 AM",etrade_supply,4.86,4.93
BTY-COV-1517,"Rear Battery Cover for Sony Xperia Z3 - Black","09/15/17 03:00 PM",0,0,3.06,7.119,5.59,0.99,"01/13/19 01:00 AM",etrade_supply,3.28,3.33
BTY-COV-1523,"HTC Desire 610 Back cover Blue",N/A,0,0,6.15,10.7625,9.09,4.29,"01/13/19 01:00 AM",etrade_supply,4.4,4.46
BTY-COV-1529,"Back Battery Door Cover with Camera Lens for HTC ONE M8 831C with Verizon Logo - Gunmetal Gray",N/A,0,0,0,29.95,0,19.99,"01/13/19 01:00 AM",etrade_supply,19.7,20
BTY-COV-1557,"Motorola Moto G XT1032 XT1031 XT1028 Rear Back Housing Frame","09/08/15 11:42 AM",0,0,6.99,12.23,0,4.99,"01/13/19 01:00 AM",etrade_supply,5.18,5.26
SRN-SAM-1328,"Asus ZenFone 5 LCD With Digitizer Assembly - Black",N/A,0,0,14.52,21.78,19.69,19.99,"01/13/19 01:00 AM",etrade_supply,26.61,27.01
SRN-SAM-1329,"Asus ZenFone 6 LCD With Digitizer Assembly - Black",N/A,0,0,19.28,27.956,25.69,21.99,"01/13/19 01:00 AM",etrade_supply,16.93,17.19
BTY-COV-1590,"Rear Housing for HTC One M8 - Glacial Silver","01/05/17 12:04 PM",0,0,11.27,17.47,15.44,19.99,"01/13/19 01:01 AM",etrade_supply,20.85,21.16
BTY-COV-1598,"Rear Housing for Samsung Galaxy Note 5 - Black Sapphire","12/31/18 01:33 PM",1,10,8.03,19.99,19.99,9.99,"01/13/19 01:20 AM",etrade_supply,21.3,21.62
BTY-COV-160,"Rear Housing Frame for Samsung Galaxy S3 i535 - White","02/16/17 04:55 PM",0,55,0,4.95,3.89,0.99,"01/13/19 01:20 AM",etrade_supply,3.21,3.25
BTY-COV-1616,"Rear Housing for Samsung Galaxy S6 Edge - Gold Platinum","09/25/18 04:36 PM",0,4,6.79,23.32,21.39,11.99,"01/13/19 01:20 AM",etrade_supply,25.52,25.91
BTY-COV-1617,"Rear Housing for Samsung Galaxy S6 Edge - Black Sapphire",N/A,0,3,16.08,23.32,21.39,10.49,"01/13/19 01:20 AM",etrade_supply,25.52,25.91
BTY-COV-1618,"Rear Housing for Samsung Galaxy S6 Edge - White Pearl",N/A,0,5,20.75,29.05,26.99,11.49,"01/13/19 01:20 AM",etrade_supply,25.52,25.91
BTY-COV-1640,"Front Bezel Frame for LG G3 - Black","01/09/17 03:24 PM",0,46,5.3,9.35,7.89,8.99,"01/13/19 01:20 AM",etrade_supply,5.81,5.9
BTY-COV-1642,"Front Bezel Frame for LG G3 - White","01/24/17 12:39 PM",0,4,4.9,9.35,7.89,0,"01/13/19 01:20 AM",etrade_supply,9.12,9.26
BTY-COV-1645,"Midframe Chassis for Samsung Galaxy Note 4 N910A N910T - Black",N/A,0,0,0,14.99,0,10.99,"01/13/19 01:20 AM",etrade_supply,11.38,11.55
BTY-COV-1646,"Midframe Chassis for Samsung Galaxy Note 4 N910A N910T - White",N/A,0,0,0,14.99,0,5.49,"01/13/19 01:20 AM",etrade_supply,8.52,8.66
BTY-COV-1647,"Midframe Chassis for Samsung Galaxy Note 4 N910V N910P - Black","03/21/18 10:59 AM",0,0,10.93,19.99,0,14.19,"01/13/19 01:21 AM",etrade_supply,11.38,11.55
BTY-COV-1648,"Midframe Chassis for Samsung Galaxy Note 4 N910V N910P - White","02/01/18 02:18 PM",0,3,11.29,16.99,0,14.49,"01/13/19 01:40 AM",etrade_supply,8.52,8.66
BTY-COV-1661,"Back Cover Replacement for Motorola Droid Turbo",N/A,0,0,0,14.99,0,10.99,"01/13/19 01:40 AM",etrade_supply,11.15,11.32
BTY-COV-1667,"Midframe for Galaxy S6 Edge G925V G925P - White","07/19/16 01:31 PM",0,1,17.53,25.42,23.39,9.99,"01/13/19 01:40 AM",etrade_supply,25.52,25.91
BTY-COV-1668,"Midframe Replacement for Samsung Galaxy S6 Edge G925T G925A - White","08/29/17 02:19 PM",0,2,13.2,25.42,0,0,"01/13/19 01:40 AM",etrade_supply,25.52,25.91
BTY-COV-1670,"Midframe Replacement for Samsung Galaxy S6 Edge G925T G925A - Gold",N/A,0,0,0,25.42,0,0,"01/13/19 01:40 AM",etrade_supply,25.52,25.91
BTY-COV-1680,"Midframe Bezel for Samsung Galaxy S3 i747 T999 - Black",N/A,0,9,0,9.95,0,0.99,"01/13/19 01:40 AM",etrade_supply,4.87,4.94
BTY-COV-1688,"BlackBerry Bold 9900 Replacement Battery Cover",N/A,0,0,0,6.99,0,2.99,"01/13/19 01:40 AM",etrade_supply,4.39,4.45
SRN-LGM-629,"LG K10 LCD and Touch Screen Digitizer with Frame K10 K420N K410 K430 MS428","09/25/18 04:36 PM",1,0,26.71,57.1863,57.1863,49.99,"01/13/19 01:41 AM",etrade_supply,57.9,58.77
BTY-COV-170,"Samsung Galaxy S4 i545 Rear Housing Frame - White","03/06/18 02:23 PM",0,2,3.48,6.91,5.49,3.99,"01/13/19 01:41 AM",etrade_supply,3.46,3.52
BTY-COV-172,"Rear Housing for Samsung Galaxy Note 2 i605  - White","12/11/17 12:12 PM",0,0,3.68,9.59,8.29,0.99,"01/13/19 01:41 AM",etrade_supply,6.41,6.51
BTY-COV-182,"Rear Housing for Samsung Galaxy Note 2 i605 - Gray","11/30/15 01:02 PM",0,0,5.33,9.59,8.29,0.99,"01/13/19 02:00 AM",etrade_supply,6.41,6.51
BTY-COV-228,"Motorola Atrix HD MB886 Back Housing",N/A,0,0,0,8.95,4.99,2.89,"01/13/19 02:01 AM",etrade_supply,3.03,3.07
BTY-COV-230,"Motorola Atrix HD MB886 Front Frame - Black",N/A,0,0,0,8.95,3.99,2.89,"01/13/19 02:01 AM",etrade_supply,3.03,3.07
BTY-COV-312,"Motorola Droid M XT907 Front Lower Trim Frame Cover - White",N/A,0,0,0,5.95,3.99,1.49,"01/13/19 02:01 AM",etrade_supply,1.6,1.62
BTY-COV-380,"Motorola MOTO X XT1060 Back Battery Door Cover Black",N/A,0,0,0,11.95,0,1.99,"01/13/19 02:01 AM",etrade_supply,4.4,4.46
BTY-COV-440,"Midframe Bezel for Samsung Galaxy S3 i535 R530 - Brown",N/A,0,27,0,7.95,4.99,0.99,"01/13/19 02:01 AM",etrade_supply,4.82,4.89
BTY-COV-442,"Midframe Bezel for Samsung Galaxy S3 i535 R530 - Black",N/A,0,7,0,7.95,5.99,0.99,"01/13/19 02:01 AM",etrade_supply,1.72,1.75
SRN-NOK-066,"LCD + Touch Screen Digitizer with Frame for Nokia Lumia 1020 Black","11/02/17 03:22 PM",0,1,51.39,70.42,64.19,79.97,"01/13/19 02:20 AM",etrade_supply,42.3,42.94
SRN-NOK-072,"LCD + Touch Screen Digitizer for Nokia Lumia 925 Black","07/13/16 11:32 AM",0,6,34.63,48.3,48.3,49.99,"01/13/19 02:20 AM",etrade_supply,31.16,31.63
SRN-NOK-082,"Touch Screen Digitizer for Nokia Lumia 520 Black","05/28/15 12:44 PM",0,5,5.9,10.62,9.19,5.99,"01/13/19 02:20 AM",etrade_supply,5.76,5.85
SRN-NOK-084,"Touch Screen Digitizer for Nokia Lumia 625 Black","09/15/15 01:48 PM",0,6,5.84,10.512,9.09,3.99,"01/13/19 02:20 AM",etrade_supply,5.76,5.85
SRN-NOK-086,"Touch Screen Digitizer for Nokia Lumia 820 Black","03/28/16 12:37 PM",0,4,4.19,9.54,8.29,4.49,"01/13/19 02:20 AM",etrade_supply,10.13,10.29
SRN-NOK-088,"Touch Screen Digitizer for Nokia Lumia 920 Black","07/10/17 01:59 PM",0,2,6.22,11.2525,9.49,6.49,"01/13/19 02:20 AM",etrade_supply,10.88,11.04
SRN-NOK-153,"Nokia Lumia 1520 LCD With Digitizer Assembly","10/05/17 01:31 PM",0,1,39.65,53.64,48.76,47.49,"01/13/19 02:20 AM",etrade_supply,33.03,33.53
SRN-NOK-165,"LCD and Touch Screen Digitizer for Nokia Lumia 925 - Black",N/A,0,0,0,49.99,0,0,"01/13/19 02:20 AM",etrade_supply,31.16,31.63
SRN-SAM-036,"LCD and Touch Screen Digitizer for Samsung Galaxy Nexus - Black","05/06/15 10:49 AM",0,3,66.51,89.7885,49.99,48.99,"01/13/19 02:20 AM",etrade_supply,65.05,66.03
BTY-COV-468,"Midframe Bezel for Samsung Galaxy S3 i9300 - Silver",N/A,0,4,0,6.95,0,0.99,"01/13/19 02:40 AM",etrade_supply,5.69,5.78
BTY-COV-476,"Rear Housing for Samsung Galaxy Note 2 N7105 LTE - Gray",N/A,0,0,0,9.95,0,2.99,"01/13/19 02:40 AM",etrade_supply,7.18,7.28
BTY-COV-478,"Rear Housing With Black Lens for Samsung Galaxy Note 3 N900A ATT  Black ","09/07/18 11:38 AM",0,2,3.5,10.73,9.29,0,"01/13/19 02:40 AM",etrade_supply,6.4,6.5
BTY-COV-494,"HTC Inspire Back Battery Door Cover","03/25/15 01:12 PM",0,0,2.63,5.9175,4.39,0,"01/13/19 02:40 AM",etrade_supply,2.66,2.7
BTY-COV-504,"Rear Housing for Samsung Galaxy S5 - White","05/31/18 12:28 PM",0,3,3.79,9.99,7.79,4.99,"01/13/19 02:40 AM",etrade_supply,6.55,6.65
BTY-COV-514,"Midframe Bezel for Samsung Galaxy S4 Mini - White",N/A,0,7,0,11.95,0,0.99,"01/13/19 02:41 AM",etrade_supply,5.78,5.87
BTY-COV-516,"Samsung Galaxy S4 Mini i9195 Rear Housing White",N/A,0,3,0,7.95,0,0.99,"01/13/19 02:41 AM",etrade_supply,4.86,4.93
BTY-COV-522,"Midframe Bezel for Samsung Galaxy S3 Mini - White","09/01/16 12:00 PM",0,0,2.58,7.791,6.19,0,"01/13/19 03:00 AM",etrade_supply,4.87,4.94
BTY-COV-526,"Samsung Galaxy S3 Mini i8190 Rear Housing White",N/A,0,8,0,5.95,0,0.99,"01/13/19 03:00 AM",etrade_supply,4.22,4.28
BTY-COV-536,"Sony Xperia Z1 L39h Front Housing - White",N/A,0,7,0,7.95,0,0.99,"01/13/19 03:00 AM",etrade_supply,4.4,4.46
BTY-COV-540,"Sony Xperia Z1 L39h Battery Door with Xperia Logo White","12/18/15 12:18 PM",0,0,1.87,6.35,4.69,0,"01/13/19 03:00 AM",etrade_supply,3.78,3.84
BTY-COV-542,"Sony Xperia Z1 L39h Rear Housing - Black","05/30/17 03:57 PM",0,0,2.42,5.78,4.29,0,"01/13/19 03:00 AM",etrade_supply,5.18,5.26
BTY-COV-544,"Sony Xperia Z1 L39h Rear Housing - White",N/A,0,0,0,6.95,0,0,"01/13/19 03:00 AM",etrade_supply,5.18,5.26
BTY-COV-546,"Sony Xperia Z L36h Front Housing - Black",N/A,0,5,0,8.95,0,0.99,"01/13/19 03:00 AM",etrade_supply,4.4,4.46
BTY-COV-548,"Sony Xperia Z L36h Front Housing - White",N/A,0,9,0,8.95,0,0.99,"01/13/19 03:00 AM",etrade_supply,4.4,4.46
BTY-COV-560,"Sony Xperia Z1 L39h Front Housing - Purple",N/A,0,4,0,7.95,0,0.99,"01/13/19 03:00 AM",etrade_supply,5.81,5.9
BTY-COV-562,"Sony Xperia Z1 L39h Front Housing Bezel - Black",N/A,0,6,0,7.95,0,0.99,"01/13/19 03:00 AM",etrade_supply,4.4,4.46
BTY-COV-572,"Battery Cover with NFC-QI Wireless Charging Patch for LG G3 D850 AT&T - Black","09/16/15 12:52 PM",0,0,6.63,11.6025,9.79,0,"01/13/19 03:00 AM",etrade_supply,7.82,7.94
BTY-COV-576,"Battery Cover with NFC-QI Wireless Charging Patch for LG G3 D850 AT&T - White","01/18/16 10:44 AM",0,0,6.42,11.85,9.99,0,"01/13/19 03:01 AM",etrade_supply,9.54,9.68
BTY-COV-580,"Battery Cover with NFC-QI Wireless Charging Verizon for LG G3 VS985 - White","03/25/15 01:12 PM",0,0,11.57,17.9335,15.89,0,"01/13/19 03:01 AM",etrade_supply,10.49,10.65
BTY-COV-604,"Back Battery Door Cover with Camera Lens for HTC One M8 831C Gunmetal Gray","12/10/15 01:52 PM",0,0,16.94,24.56,22.59,0,"01/13/19 03:20 AM",etrade_supply,20.85,21.16
BTY-COV-608,"Rear Housing Frame with Loudspeaker Headphone Jack for Samsung Galaxy S5","07/20/18 05:01 PM",0,3,2.89,11.34,9.59,5.99,"01/13/19 03:20 AM",etrade_supply,6.55,6.65
BTY-COV-610,"Back Battery Door Cover with Volume Power Buttons for HTC One M7 801e Silver","06/06/16 03:54 PM",0,0,7.42,13.787,11.19,1.99,"01/13/19 03:20 AM",etrade_supply,20.85,21.16
BTY-HTC-006,"HTC Amaze 4G BG86100 Replacement Battery",N/A,0,0,0,6.95,2.99,0,"01/13/19 03:20 AM",etrade_supply,7.24,7.35
BTY-LG-052,"LG Optimus G Pro E980 E985 F240K BL-48TH Replacement Battery 4000 mAH",N/A,0,0,0,19.95,4.99,0,"01/13/19 03:20 AM",etrade_supply,10.88,11.04
SRN-MOT-638,"Motorola Moto E 2nd Gen XT1505 XT1511 XT1524 XT1527 XT1528 LCD With Digitizer - Black","05/11/18 01:24 PM",0,5,13.99,21.02,18.99,16.99,"01/13/19 03:21 AM",etrade_supply,20.35,20.66
SRN-MOT-641,"Motorola Moto G XT1031 XT1032 XT1033 LCD Touch Screen Assembly w/ Frame Black","12/19/17 03:54 PM",0,0,18.12,31.7,29.49,20.99,"01/13/19 03:40 AM",etrade_supply,28.94,29.38
SRN-MOT-660,"LCD and Touch Screen Digitizer for Motorola Moto Z Droid XT1650-01 - Black","10/18/18 11:57 AM",0,3,65.08,137.96,137.96,101.29,"01/13/19 03:40 AM",etrade_supply,107.53,109.16
SRN-MOT-666,"LCD and Digitizer Replacement for Droid Maxx 2 XT1565 - Black","04/09/18 04:29 PM",0,2,22.56,42.99,0,26.29,"01/13/19 03:40 AM",etrade_supply,43.06,43.71
SRN-MOT-667,"LCD and Digitizer Replacement for Droid Maxx 2 XT1565 - White",N/A,0,0,0,42.99,0,28.99,"01/13/19 03:40 AM",etrade_supply,43.05,43.7
SRN-MOT-668,"LCD and Digitizer Replacement for Droid Ultra Maxx XT1080 XT1080M",N/A,0,0,0,49.99,0,40.99,"01/13/19 03:40 AM",etrade_supply,56.67,57.53
SRN-MOT-669,"LCD and Digitizer Replacement for Motorola Moto G3 - Black",N/A,0,0,0,28.99,0,18.99,"01/13/19 03:40 AM",etrade_supply,28.93,29.37
SRN-MOT-670,"LCD and Digitizer Replacement for Motorola Moto G3 - White",N/A,0,0,0,28.99,0,18.99,"01/13/19 03:40 AM",etrade_supply,28.93,29.37
SRN-MOT-673,"LCD and Touch Screen Digitizer for Motorola Moto E XT1021 XT1022 XT1025 - Black",N/A,0,0,0,20.99,0,16.09,"01/13/19 03:40 AM",etrade_supply,22.75,23.09
SRN-MOT-674,"LCD and Digitizer Replacement with Frame for Motorola Moto X Pure Edition XT1575 - Black","12/21/16 01:09 PM",0,0,0,56.95,0,43.99,"01/13/19 03:41 AM",etrade_supply,57.19,58.06
SRN-MOT-675,"LCD and Digitizer Replacement with Frame for Motorola Moto X Pure Edition XT1575 - White",N/A,0,0,38.47,89.99,0,47.89,"01/13/19 03:41 AM",etrade_supply,57.19,58.06
SRN-MOT-676,"LCD and Digitizer Replacement with Frame for Motorola Moto X Play - Black",N/A,0,0,0,49.99,0,32.99,"01/13/19 03:41 AM",etrade_supply,38.12,38.69
SRN-MOT-677,"LCD and Digitizer Replacement with Frame for Motorola Moto X Play - White",N/A,0,0,0,49.99,0,32.99,"01/13/19 03:41 AM",etrade_supply,38.12,38.69
SRN-MOT-678,"LCD and Digitizer Replacement with Frame for Motorola Moto X (2nd Gen) - Black","03/06/18 02:23 PM",0,2,51.74,134.99,0,94.99,"01/13/19 03:41 AM",etrade_supply,63.78,64.75
SRN-MOT-679,"LCD and Digitizer Replacement with Frame for Motorola Moto X (2nd Gen) - White","10/05/17 01:31 PM",0,2,66.93,134.99,0,78.99,"01/13/19 03:41 AM",etrade_supply,73.7,74.81
SRN-MOT-680,"LCD and Touch Screen Digitizer for Motorola Moto Z Play Droid XT1635-01 ZT1635-02 - Black","11/20/18 12:12 PM",1,4,38.37,137.96,137.96,68.99,"01/13/19 03:41 AM",etrade_supply,73.12,74.23
SRN-MOT-681,"LCD and Touch Screen Digitizer for Motorola Moto Z Play Droid XT1635-01 ZT1635-02 - White","12/12/16 11:19 AM",0,0,109.14,139.15,94.69,94.69,"01/13/19 04:00 AM",etrade_supply,73.12,74.23
SRN-MOT-681,"LCD and Touch Screen Digitizer for Motorola Moto Z Play Droid XT1635-01 ZT1635-02 - White","12/12/16 11:19 AM",0,0,109.14,139.15,94.69,94.69,"01/13/19 04:00 AM",cell_parts_hub,65,0
SRN-MOT-686,"LCD and Touch Screen Digitizer with Frame for Motorola Moto X Force - Black","06/23/17 03:30 PM",0,3,79.97,144.99,0,89.97,"01/13/19 04:00 AM",etrade_supply,104,105.57
SRN-NOK-006,"Nokia Lumia 610 LCD Screen",N/A,0,14,0,36.95,14.89,14.97,"01/13/19 04:00 AM",etrade_supply,8.65,8.79
FLX-MOT-519,"Loudspeaker Replacement for Motorola Droid Turbo 2",N/A,0,0,1.17,2.81,2.19,1.99,"01/13/19 04:02 AM",cell_parts_hub,7.99,0
FLX-MOT-526,"Front Camera Replacement for Motorola Droid Turbo 2",N/A,0,0,0,39.99,0,4.99,"01/13/19 04:02 AM",etrade_supply,12.83,13.03
FLX-MOT-524,"Rear Camera Replacement for Motorola Droid Turbo 2",N/A,0,0,0,29.99,0,6.99,"01/13/19 04:02 AM",etrade_supply,16.98,17.24
FLX-LGM-176,"LG Galaxy Nexus 4 E960 Loudspeaker Module","08/07/15 02:32 PM",0,5,1.95,4.485,3.69,0.99,"01/13/19 04:03 AM",etrade_supply,5.82,5.91
FLX-LGM-178,"LG Optimus G LS970 E970 Audio Headphone Jack Flex","05/13/15 01:39 PM",0,3,1.74,4.002,3.29,0.99,"01/13/19 04:03 AM",etrade_supply,3.48,3.54
FLX-LGM-180,"LG Galaxy Nexus 4 E960 Front Camera","08/07/15 02:32 PM",0,7,2.27,5.1075,3.79,0.99,"01/13/19 04:03 AM",etrade_supply,2.93,2.97
FLX-LGM-182,"LG Galaxy Nexus 4 E960 Back Camera",N/A,0,2,0,9.95,7.59,0.99,"01/13/19 04:03 AM",etrade_supply,6.29,6.39
FLX-LGM-184,"LG Optimus G E970 Loudspeaker Module",N/A,0,14,0,8.95,6.39,0.99,"01/13/19 04:03 AM",etrade_supply,4.36,4.42
FLX-LGM-200,"LG Optimus G Pro E980 Charging Dock Port Connector Flex Cable","01/24/18 11:42 AM",0,0,3.39,9.044,7.69,7.99,"01/13/19 04:20 AM",etrade_supply,6.29,6.39
FLX-LGM-286,"LG Optimus G LS970 Wifi and Bluetooth Flex",N/A,0,23,0,6.95,4.59,0.99,"01/13/19 04:20 AM",etrade_supply,1.38,1.4
FLX-LGM-294,"LG Optimus G LS970 Loudspeaker Flex",N/A,0,26,0,6.95,4.49,0.99,"01/13/19 04:20 AM",etrade_supply,1.66,1.68
FLX-LGM-296,"LG Optimus G LS970 Rear Component Housing",N/A,0,32,0,14.95,12.59,0.99,"01/13/19 04:20 AM",etrade_supply,6.29,6.39
FLX-LGM-298,"LG Optimus G LS970 Volume Key Flex Cable","09/15/15 01:34 PM",0,5,1.57,3.611,2.99,0.99,"01/13/19 04:20 AM",etrade_supply,1.16,1.18
FLX-LGM-302,"LG Optimus G LS970 Charging Port Flex","11/05/15 12:03 PM",0,4,3.38,7.098,5.59,0.99,"01/13/19 04:20 AM",etrade_supply,1.66,1.68
FLX-LGM-336,"LG Optimus G2 Verizon VS980 Loudspeaker Flex","01/26/16 01:44 PM",0,1,5.74,10.5525,8.89,0.99,"01/13/19 04:20 AM",etrade_supply,5.2,5.28
FLX-LGM-360,"LG Optimus G2 Verizon VS980 Charging Port Headphone Jack Volume Flex","09/26/17 10:48 AM",0,4,4.82,10.548,9.09,0.99,"01/13/19 04:40 AM",etrade_supply,9.12,9.26
FLX-LGM-386,"LG Optimus G2 D800 D801 D803 Charging Port Headphone Jack Mic Flex Cable","01/17/17 02:58 PM",0,1,6.89,12.06,10.13,0.99,"01/13/19 04:40 AM",etrade_supply,6.54,6.64
FLX-LGM-420,"LG Optimus G ATT E970 Rear Component Housing",N/A,0,12,0,15.95,13.69,0.99,"01/13/19 04:40 AM",etrade_supply,13.08,13.28
FLX-LGM-452,"LG Google Nexus 4 E960 Vibrator Motor","03/18/15 10:49 AM",0,4,1.29,3.096,2.39,0.99,"01/13/19 04:40 AM",etrade_supply,1.76,1.79
FLX-LGM-458,"LG Google Nexus 4 E960 Sim Card Tray","10/03/16 11:02 AM",0,1,2.1,4.95,3.69,0.99,"01/13/19 04:40 AM",etrade_supply,2.41,2.45
FLX-LGM-476,"LG Optimus G Pro E980 E985 E986 Ear Piece Speaker","11/05/15 12:03 PM",0,5,1.47,3.528,2.79,0.99,"01/13/19 04:40 AM",etrade_supply,1.16,1.18
FLX-LGM-510,"LG Optimus G2 VS980 LS980 D800 D801 D803 D805 Proximity Sensor Flex","07/07/15 11:42 AM",0,3,4.12,7.828,6.59,0.99,"01/13/19 04:40 AM",etrade_supply,5.47,5.55
FLX-LGM-512,"LG Google Nexus 5 D820 D821 WiFi Antenna Cable Wire - Black","01/17/17 02:58 PM",0,7,1.48,3.726,3.09,1.49,"01/13/19 04:41 AM",etrade_supply,1.03,1.04
FLX-LGM-514,"LG Google Nexus 5 D820 D821 GPS Antenna Cable Wire - White","04/19/16 10:51 AM",0,19,0,6.95,4.19,0.99,"01/13/19 04:41 AM",etrade_supply,1.03,1.04
FLX-LGM-518,"LG Google Nexus 5 D820 D821 Back Facing Rear Camera Flex Cable","11/19/15 12:09 PM",0,5,5.44,10.098,10.098,7.99,"01/13/19 04:41 AM",etrade_supply,11.74,11.92
FLX-LGM-520,"LG Google Nexus 5 D820 D821 Charging Port Flex Cable","03/21/18 03:19 PM",0,2,6.41,16.99,9.59,8.09,"01/13/19 05:00 AM",etrade_supply,7.95,8.07
FLX-LGM-522,"LG Google Nexus 5 D820 D821 Earpiece Speaker Module","06/12/17 01:03 PM",0,7,1.02,3.528,2.79,1.19,"01/13/19 05:00 AM",etrade_supply,2.28,2.32
FLX-LGM-524,"LG Google Nexus 5 D820 D821 Front Facing Camera Flex Cable","08/07/15 02:32 PM",0,2,2.76,6.21,4.59,5.79,"01/13/19 05:00 AM",etrade_supply,9.27,9.41
FLX-LGM-526,"LG Google Nexus 5 D820 D821 Loudspeaker Flex Cable","07/03/17 12:08 PM",0,1,2.44,9.44,7.99,2.49,"01/13/19 05:00 AM",etrade_supply,3.26,3.3
FLX-LGM-534,"LG Optimus G PRO E980 Front Camera Flex","02/29/16 12:01 PM",0,3,2.48,5.58,4.09,0.99,"01/13/19 05:00 AM",etrade_supply,2.39,2.43
FLX-LGM-538,"LG Optimus G PRO E980 Earpiece Speaker Flex","06/13/16 11:28 AM",0,0,1.33,3.504,2.79,0,"01/13/19 05:00 AM",etrade_supply,1.16,1.18
FLX-LGM-540,"LG Optimus G PRO E980 Headphone Jack Flex","03/07/16 04:22 PM",0,0,1.43,3.749,3.09,0.79,"01/13/19 05:00 AM",etrade_supply,2.85,2.89
FLX-LGM-544,"LG Optimus G PRO E980 Vibrator Motor Flex",N/A,0,3,0,5.95,0,0.99,"01/13/19 05:01 AM",etrade_supply,1.76,1.79
FLX-LGM-550,"LG Optimus G PRO E980 SD and Sim Card Flex","04/13/16 01:49 PM",0,0,4.39,7.771,6.59,0,"01/13/19 05:01 AM",etrade_supply,8.78,8.92
FLX-LGM-552,"LG Optimus G PRO E980 Home Button Charging Port Flex","01/24/18 11:42 AM",0,-2,3.74,7.938,6.29,0.99,"01/13/19 05:20 AM",etrade_supply,5.18,5.26
FLX-LGM-564,"LG G2 Optimus G D800 D801 D802 D803 D805 LS980 VS980 Sim Card Holder Tray White","07/03/17 12:08 PM",0,2,1.99,6.39,4.69,0.99,"01/13/19 05:20 AM",etrade_supply,2.52,2.56
FLX-LGM-570,"Rear Camera Flex Cable for LG G3","08/06/18 11:36 AM",0,3,2.38,10.01,8.69,3.49,"01/13/19 05:20 AM",etrade_supply,6.52,6.62
FLX-LGM-571,"Charging Port for LG G3","05/16/17 02:18 PM",0,0,1.05,3.95,0,0.99,"01/13/19 05:21 AM",etrade_supply,1.03,1.04
FLX-LGM-574,"Front Camera for LG G3","02/16/17 04:55 PM",0,3,6.93,13.583,10.99,2.99,"01/13/19 05:21 AM",etrade_supply,7.84,7.96
FLX-LGM-575,"Earpiece for LG G3","08/06/18 11:36 AM",0,4,0.82,2.49,3.79,1.19,"01/13/19 05:40 AM",etrade_supply,2.32,2.36
FLX-LGM-577,"Loudspeaker for LG G3 - White","11/05/15 12:03 PM",0,4,7.68,13.056,10.59,3.99,"01/13/19 05:40 AM",etrade_supply,7.58,7.69
FLX-LGM-582,"LG Optimus G2 LS980 Charging Port Headphone Jack Volume Flex","11/19/15 12:09 PM",0,2,4.75,10.53,9.09,0.99,"01/13/19 05:40 AM",etrade_supply,9.2,9.34
FLX-LGM-584,"LG Optimus G2 D800 D801 LS980 Loudspeaker ","01/17/17 02:58 PM",0,4,1.19,3.07,2.39,0.99,"01/13/19 05:40 AM",etrade_supply,2.78,2.82
FLX-LGM-595,"Front Camera for LG G4",N/A,0,5,4.95,9.41,7.99,3.49,"01/13/19 05:40 AM",etrade_supply,5.2,5.28
FLX-LGM-596,"Vibration Motor for LG G4",N/A,0,3,1.53,3.52,2.89,2.99,"01/13/19 05:41 AM",etrade_supply,1.72,1.75
FLX-LGM-604,"Charging Port Flex Cable for LG G5","08/06/18 11:36 AM",0,5,3.88,12.99,6.09,6.09,"01/13/19 05:41 AM",etrade_supply,7.81,7.93
FLX-LGM-620,"Rear Camera for LG G4","03/13/18 12:26 PM",0,3,9.29,17.99,11.69,11.69,"01/13/19 05:41 AM",etrade_supply,13.14,13.34
FLX-LGM-621,"Headphone Jack for LG G4","06/02/17 11:36 AM",0,2,1.47,6.28,4.69,2.99,"01/13/19 06:00 AM",etrade_supply,2.92,2.96
FLX-LGM-623,"Rear Camera Lens Glass Cover for LG G5","04/25/18 04:13 PM",1,2,1.42,3.48,2.68,1.99,"01/13/19 06:00 AM",etrade_supply,2.07,2.11
FLX-LGM-627,"Rear Camera Lens for LG G4 - Grey",N/A,0,0,0,6.99,0,0,"01/13/19 06:00 AM",etrade_supply,3.17,3.21
FLX-LGM-628,"Rear Camera Lens for LG G4 - Gold",N/A,0,0,0,6.99,0,0,"01/13/19 06:00 AM",etrade_supply,4.17,4.23
FLX-LGM-629,"Rear Camera Lens for LG G4 - White",N/A,0,0,0,6.99,0,0,"01/13/19 06:00 AM",etrade_supply,4.17,4.23
FLX-SAM-1321,"Rear Camera for Samsung Galaxy Note 4","03/15/18 01:59 PM",0,3,2.29,9.5,9.5,3.29,"01/13/19 06:00 AM",etrade_supply,4.81,4.88
FLX-SAM-1349,"Front Camera for Samsung Galaxy S6 Edge","04/09/18 04:29 PM",0,4,1.79,7.77,2.29,2.29,"01/13/19 06:20 AM",etrade_supply,2.08,2.12
FLX-SAM-1428,"Rear Camera for Samsung Galaxy S6 Edge ","07/05/18 04:13 PM",0,7,2.5,12.06,12.06,5.49,"01/13/19 06:20 AM",etrade_supply,6.27,6.37
FLX-MOT-386,"Motorola MOTO X XT1060 Sim Card Tray - Black -","08/26/16 03:40 PM",0,28,4.22,8.018,6.79,0.99,"01/13/19 06:20 AM",etrade_supply,8.67,8.81
FLX-MOT-388,"Motorola MOTO X XT1060 Sim Card Tray - White","01/05/16 02:21 PM",0,4,1.59,3.473,2.79,0.99,"01/13/19 06:20 AM",etrade_supply,3.25,3.29
FLX-MOT-414,"Motorola Droid MAXX XT1080M XT1080 Sim Card Tray","12/30/15 02:07 PM",0,0,1.91,4.39,3.59,0,"01/13/19 06:21 AM",etrade_supply,4.17,4.23
FLX-MOT-488,"Motorola Moto G XT1032 SIM Card Reader Contact","07/07/15 11:42 AM",0,4,1.5,3.6,2.79,0.99,"01/13/19 06:21 AM",etrade_supply,1.73,1.76
FLX-MOT-490,"Motorola Moto G XT1032 Earpiece Speaker","03/01/17 12:08 PM",0,2,0.65,1.8,1.59,0.99,"01/13/19 06:21 AM",etrade_supply,1.01,1.02
FLX-MOT-498,"Motorola Moto X XT1095 XT1096 XT1097 Sim Card Tray","04/30/15 02:48 PM",0,1,0,5.95,0,0.99,"01/13/19 06:21 AM",etrade_supply,4.39,4.45
FLX-MOT-499,"Motorola Droid MAXX XT1080M XT1080 Loudspeaker Buzzer Assembly","01/17/17 02:58 PM",0,0,1.19,2.86,2.2,0,"01/13/19 06:21 AM",etrade_supply,6.54,6.64
FLX-MOT-501,"Motorola Moto G XT1032 Power Button Key",N/A,0,9,0.25,0.875,0.59,0.99,"01/13/19 06:21 AM",etrade_supply,0.74,0.75
FLX-MOT-510,"Motorola Droid Ultra XT1080 Loudspeaker Ringer Headphone Jack and Vibration Motor","09/15/16 01:37 PM",0,0,1.41,4.95,3.69,0,"01/13/19 06:21 AM",etrade_supply,6.54,6.64
FLX-MOT-511,"Motorola Moto X XT1060 Loudspeaker Ringer Headphone Jack Housing","12/30/15 02:07 PM",0,3,2.33,6.17,4.59,0.99,"01/13/19 06:21 AM",etrade_supply,6.54,6.64
FLX-MOT-515,"Earpiece Speaker Replacement for Motorola Droid Turbo","02/13/17 01:32 PM",0,0,0.85,2.42,1.89,1.99,"01/13/19 06:40 AM",etrade_supply,1,1.01
FLX-MOT-517,"Rear Camera Replacement for Motorola Droid Turbo",N/A,0,0,6.59,11.53,9.69,6.99,"01/13/19 06:40 AM",etrade_supply,18.27,18.54
