SKU,Title,"Last Received","30 Days Item Sale",Quantity,"True Cost",D1,P1,"Sale Price","Date Updated",Competitor,"Previous Price",Price
BT-BP-30056,"BinTEK Battery for Samsung Galaxy S EB575152VU 1500mAH Li-Ion Premium ","01/20/17 04:34 PM",1,5,2.02,7.99,7.99,0.99,"08/03/18 03:20 PM",etrade_supply,6.99,6.95
BT-BP-30062,"BinTEK Battery for Samsung Galaxy S5 EB-BG900BBC 2800mAH Li-Ion Premium ","08/02/18 12:40 PM",6,44,4.47,7.99,7.99,6.99,"08/03/18 03:20 PM",etrade_supply,7.96,7.91
BT-BP-30062,"BinTEK Battery for Samsung Galaxy S5 EB-BG900BBC 2800mAH Li-Ion Premium ","08/02/18 12:40 PM",6,44,4.47,7.99,7.99,6.99,"08/03/18 03:20 PM",maya_cellular,0,5.99
BT-BP-30064,"BinTEK Battery for Samsung Galaxy Note 4 EB-KN910BWEGW 3220mAH Li-Ion Premium (With NFC)","04/17/18 10:39 AM",25,740,5,19.99,19.99,7.99,"08/03/18 03:20 PM",etrade_supply,9.6,9.54
BT-BP-30066,"BinTEK HTC One M8 2600mAH Li-Ion Premium Battery","08/02/18 12:40 PM",3,15,4.77,13.99,13.99,6.99,"08/03/18 03:20 PM",etrade_supply,11,10.93
BT-BP-30074,"BinTEK Battery for iPhone 6 Plus 2915 mAH Li-Polymer Premium ","08/01/18 03:03 PM",200,182,5.83,19.99,19.99,9.99,"08/03/18 03:21 PM",etrade_supply,12.83,12.75
SRN-SAM-1414,"LCD Screen for Samsung Galaxy Core Prime","04/17/18 02:12 PM",0,2,9.02,19.98,17.99,14.89,"08/03/18 03:40 PM",etrade_supply,13.53,13.45
BT-BP-30078,"BinTEK Battery for Samsung Galaxy Note Edge EB-BN915BBC 3000mAH Li-Ion Premium ","12/05/17 03:29 PM",1,150,3.61,9.99,9.99,7.99,"08/03/18 03:40 PM",etrade_supply,8.94,8.89
BT-BP-30080,"BinTEK Battery for Samsung Galaxy S5 Mini EB-BG800BBE 2100mAH Li-Ion Premium ","01/20/17 04:34 PM",1,8,3.14,7.99,7.99,4.99,"08/03/18 03:40 PM",etrade_supply,8.94,8.89
BT-BP-30094,"BinTEK Motorola Moto X XT1056 XT1058 XT1060 XT912A EX34 2200mAH Li-Polymer Premium Battery","03/06/18 11:41 AM",0,22,3.74,13.99,13.99,6.99,"08/03/18 03:40 PM",etrade_supply,8.36,8.31
BT-BP-30104,"BinTEK Nokia Lumia 635 630 636 638 BL-5H 1830mAH Li-Ion Premium Battery","01/20/17 04:34 PM",0,20,3.88,7.99,7.99,5.99,"08/03/18 03:40 PM",etrade_supply,18.28,18.17
BT-BP-30106,"BinTEK HTC Desire 601 BM65100 2100mAH Li-Ion Premium Battery","09/23/15 04:26 PM",4,6,6.32,12.99,12.99,0.99,"08/03/18 03:40 PM",etrade_supply,14.61,14.52
BT-BP-30114,"BinTEK LG Optimus G2 /BL-54SG F320 2610mAH Li-Ion Premium Battery","01/20/17 04:34 PM",0,19,3.7,8.99,8.99,5.99,"08/03/18 03:40 PM",parts_4_cells,0,8
BT-BP-30120,"BinTEK Motorola Droid Ultra XT1080 EU20 2130mAH Li-Polymer Premium Battery","01/20/17 10:19 AM",0,0,6.53,14.99,14.99,7.99,"08/03/18 03:40 PM",etrade_supply,15.07,14.98
BT-BP-30138,"Battery for Samsung Galaxy Tab 3 10.1 6800mAH Li-Polymer","02/09/18 10:08 AM",0,0,7.72,17.99,17.99,8.99,"08/03/18 03:40 PM",etrade_supply,13.4,13.32
BT-BP-30158,"BinTEK Battery for iPod Touch 4 980mAH Li-Polymer Premium ","06/30/17 02:35 PM",0,6,3.88,8.99,8.99,4.99,"08/03/18 04:00 PM",etrade_supply,3.83,3.81
BT-BP-30180,"BinTEK Sony XPeria Z L36H 2330mAh Li-Polymer Premium Battery","01/20/17 10:19 AM",0,6,5.19,15.99,15.99,10.99,"08/03/18 04:00 PM",etrade_supply,9.15,9.1
BT-BP-30182,"BINTEK Sony L39h Xperia Z1 C6902 C6903 C6906 3000 mAH Li-Polymer Premium Battery","01/20/17 04:34 PM",0,3,5.33,15.99,15.99,10.99,"08/03/18 04:00 PM",etrade_supply,9.15,9.1
BT-BP-30184,"BINTEK Sony Xperia Z3 Dual Battery 3100 mAH Li-Polymer Premium Battery","11/28/16 01:31 PM",0,14,3.4,8.99,8.99,7.99,"08/03/18 04:00 PM",etrade_supply,9.14,9.09
BT-BP-30192,"BinTEK Battery for iPhone 6S 1715mAH Li-Po Premium ","08/01/18 03:03 PM",447,204,4.79,14.99,9.99,8.99,"08/03/18 04:00 PM",etrade_supply,11.54,11.47
BT-BP-30194,"BinTEK Battery for LG G4 BL-51YF 3000mAH Li-Ion Premium ",N/A,8,6,6.05,10.59,8.89,3.99,"08/03/18 04:00 PM",etrade_supply,10.96,10.89
BT-BP-30208,"Battery Apple iPad 2 6930mAH Li-Polymer","06/01/18 03:17 PM",12,0,8.32,24.99,16.99,12.99,"08/03/18 04:01 PM",etrade_supply,15.87,15.78
BT-BP-30210,"Battery Apple iPad 3/4 11560mAH Li-Polymer","05/04/18 03:05 PM",70,9,10.57,19.99,19.99,13.99,"08/03/18 04:20 PM",etrade_supply,19.12,19.01
BT-BP-30216,"Battery for Apple iPad Air 2 7340mAH Li-Polymer","06/01/18 03:17 PM",5,17,13.03,24.99,16.99,16.29,"08/03/18 04:20 PM",etrade_supply,25.47,23.42
BT-BP-30220,"Battery for Apple iPad Mini 2/3 6470mAH Li-Polymer","06/01/18 03:17 PM",6,0,6.75,16.99,16.99,9.39,"08/03/18 04:20 PM",etrade_supply,15.87,15.78
BT-BP-30224,"Battery Apple iPad Mini 4 5124mAH Li-Polymer ","05/24/18 10:21 AM",8,0,18.81,29.99,29.99,12.89,"08/03/18 04:20 PM",etrade_supply,15.91,15.81
BT-BP-30226,"Battery for Apple iPad Pro 12.9 (1st Gen) - 3.77V 10307mAH Li-Polymer","05/26/17 01:11 PM",0,15,18.81,29.99,29.99,18.89,"08/03/18 04:20 PM",etrade_supply,20.7,20.58
BT-BP-30252,"BinTEK HTC One M9 2840mAH Li-Polymer Premium Battery",N/A,0,0,0,13.99,0,8.49,"08/03/18 04:20 PM",etrade_supply,11,10.93
BT-BP-30254,"BinTEK Sony Xperia M4 Aqua 2400mAH Li-Polymer Premium Battery",N/A,0,0,0,14.99,0,0,"08/03/18 04:40 PM",etrade_supply,9.15,9.1
BT-BP-30260,"BinTEK Sony Xperia Z3 Compact 2600mAH Li-Polymer Premium Battery",N/A,0,0,0,14.99,0,0,"08/03/18 04:40 PM",etrade_supply,6.98,6.94
BT-BP-30262,"BinTEK Sony Xperia T3 2500mAH Li-Polymer Premium Battery",N/A,0,0,0,9.99,0,0,"08/03/18 04:40 PM",etrade_supply,9.16,9.11
BT-BP-30270,"BinTEK Battery for Samsung Galaxy S4 Mini 1900mAH Li-Polymer Premium ",N/A,0,0,0,14.95,0,0,"08/03/18 04:40 PM",etrade_supply,9.01,8.96
BT-BP-30274,"BinTEK HTC Desire 626 2000mAH Li-Polymer Premium Battery",N/A,0,0,0,11.99,0,0,"08/03/18 04:40 PM",etrade_supply,6.98,6.94
BT-BP-30278,"BinTEK HTC Rezound 1620mAH Li-Ion Premium Battery",N/A,0,0,0,9.99,0,0,"08/03/18 04:40 PM",etrade_supply,5.47,5.44
BT-BP-30284,"BinTEK iPhone SE 1624mAh Li-Polymer Premium Battery","08/01/18 03:03 PM",64,138,4.5,19.99,7.49,7.49,"08/03/18 04:40 PM",etrade_supply,11.21,11.14
BT-BP-30284,"BinTEK iPhone SE 1624mAh Li-Polymer Premium Battery","08/01/18 03:03 PM",64,138,4.5,19.99,7.49,7.49,"08/03/18 04:41 PM",maya_cellular,5.99,0
BT-BP-30286,"BinTEK Battery for Apple Watch 42mm 250mAh Li-Polymer Premium ",N/A,0,0,0,16.99,0,0,"08/03/18 04:41 PM",etrade_supply,9.6,9.54
BT-BP-30288,"BinTEK Battery for Apple Watch 38mm 205mAh Li-Polymer Premium ",N/A,0,0,0,16.99,0,0,"08/03/18 04:41 PM",etrade_supply,9.6,9.54
BT-BP-30289,"BinTEK iPhone 7 1960mAH Li-Polymer Premium Battery","08/01/18 03:03 PM",133,93,5.37,14.99,7.6,9.99,"08/03/18 04:42 PM",etrade_supply,19.26,19.14
BTY-COV-446,"Rear Housing Frame for Samsung Galaxy S3 i747 - Black","07/18/17 11:51 AM",0,2,3.1,4.95,0,0.99,"08/03/18 05:01 PM",etrade_supply,3.89,0
BT-BP-30292,"BinTEK Battery for Samsung Galaxy J7 (2016) 3300mAh Premium ",N/A,0,0,0,18.99,0,10.49,"08/03/18 05:01 PM",etrade_supply,9.6,9.54
BT-BP-30293,"BinTEK Battery for Samsung Galaxy J5 (2016) 3100mAh Premium ",N/A,0,0,0,18.99,0,0,"08/03/18 05:01 PM",etrade_supply,9.6,9.54
BTY-BKB-006,"Blackberry Bold 9780 9700 9000 Replacement Battery",N/A,0,1,0,3.95,3.49,1.99,"08/03/18 05:01 PM",etrade_supply,1.72,1.71
BTY-COV-106,"HTC Sensation Back Battery Cover","01/05/17 12:04 PM",0,0,5.44,9.126,7.89,6.29,"08/03/18 05:01 PM",etrade_supply,6.59,6.55
BTY-COV-108,"HTC EVO 3D Battery Cover Back Door","03/25/16 11:23 AM",0,0,2.81,6.32,4.69,4.99,"08/03/18 05:01 PM",etrade_supply,5.22,5.19
BTY-COV-112,"Midframe Bezel for Samsung Galaxy S3 i535 R530 -  Blue",N/A,0,39,0,8.95,6.99,0.99,"08/03/18 05:01 PM",etrade_supply,1.74,1.73
BTY-COV-112,"Midframe Bezel for Samsung Galaxy S3 i535 R530 -  Blue",N/A,0,39,0,8.95,6.99,0.99,"08/03/18 05:01 PM",parts_4_cells,8,7
BTY-COV-114,"Midframe Bezel for Samsung Galaxy S3 i747 T999 -  Blue","07/21/15 11:30 AM",0,11,2.75,6.1875,4.59,0.99,"08/03/18 05:01 PM",etrade_supply,4.9,4.87
BTY-COV-114,"Midframe Bezel for Samsung Galaxy S3 i747 T999 -  Blue","07/21/15 11:30 AM",0,11,2.75,6.1875,4.59,0.99,"08/03/18 05:02 PM",parts_4_cells,8,7
BTY-COV-116,"Midframe Bezel for Samsung Galaxy S3 L710 -  Blue",N/A,0,9,0,7.95,4.99,0.99,"08/03/18 05:20 PM",etrade_supply,4.89,4.86
BTY-COV-116,"Midframe Bezel for Samsung Galaxy S3 L710 -  Blue",N/A,0,9,0,7.95,4.99,0.99,"08/03/18 05:20 PM",parts_4_cells,8,7
BTY-COV-118,"Midframe Bezel for Samsung Galaxy S3 i535 R530 - Silver","12/29/15 03:05 PM",0,0,3.39,7.12,5.59,0,"08/03/18 05:20 PM",parts_4_cells,8,7
BTY-COV-120,"Midframe Bezel for Samsung Galaxy S3 L710 - Silver",N/A,0,22,0,7.95,4.99,0.99,"08/03/18 05:20 PM",parts_4_cells,8,7
BTY-COV-122,"Midframe Bezel for Samsung Galaxy S3 i747 T999 -  Silver","05/09/17 01:01 PM",0,2,3.54,7.16,5.69,0.99,"08/03/18 05:20 PM",parts_4_cells,8,7
BTY-COV-126,"Rear Housing for Samsung Galaxy Note 2 i317 T889 - Gray","06/07/16 01:38 PM",0,7,4.07,8.759,7.39,0.99,"08/03/18 05:20 PM",parts_4_cells,0,6
BTY-COV-1479,"Front Housing with Bezel Frame for Blackberry Q5-Black",N/A,0,4,3.42,7.182,5.69,0.99,"08/03/18 05:21 PM",etrade_supply,3.5,3.48
BTY-COV-1481,"Front Housing with Bezel Frame for Blackberry Q5-Red",N/A,0,5,3.42,7.182,5.69,0.99,"08/03/18 05:21 PM",etrade_supply,3.5,3.48
BTY-COV-1482,"Back Cover with Camera Lens for Blackberry Q5-Black","02/03/15 03:05 PM",0,4,4.56,8.664,7.39,0.99,"08/03/18 05:21 PM",etrade_supply,1.69,1.68
BTY-COV-1483,"Back Cover with Camera Lens for Blackberry Q5-Red","02/03/15 03:05 PM",0,5,4.56,8.664,7.39,0.99,"08/03/18 05:21 PM",etrade_supply,5.29,5.26
BTY-COV-1484,"Back Cover with Camera Lens for Blackberry Q5-White","02/03/15 03:05 PM",0,4,4.56,8.664,7.39,0.99,"08/03/18 05:21 PM",etrade_supply,1.66,1.65
BTY-COV-1517,"Rear Battery Cover for Sony Xperia Z3 - Black","09/15/17 03:00 PM",0,0,3.06,7.119,5.59,0.99,"08/03/18 05:40 PM",etrade_supply,3.23,3.21
BTY-COV-1522,"Back Cover for Samsung Galaxy Note 4 - White","03/06/18 02:23 PM",0,1,2.37,7.99,2.99,3.99,"08/03/18 05:40 PM",parts_4_cells,0,4
BTY-COV-1523,"HTC Desire 610 Back cover Blue",N/A,0,0,6.15,10.7625,9.09,4.29,"08/03/18 05:40 PM",etrade_supply,4.43,4.4
BTY-COV-1529,"Back Battery Door Cover with Camera Lens for HTC ONE M8 831C with Verizon Logo - Gunmetal Gray",N/A,0,0,0,29.95,0,19.99,"08/03/18 05:40 PM",etrade_supply,21.32,21.19
BTY-COV-1557,"Motorola Moto G XT1032 XT1031 XT1028 Rear Back Housing Frame","09/08/15 11:42 AM",0,0,6.99,12.23,0,4.99,"08/03/18 05:40 PM",etrade_supply,5.22,5.19
BTY-COV-1570,"Back Cover for Samsung Galaxy Note 5 - White Pearl","05/24/18 12:31 PM",5,33,3.11,10.73,9.24,4.99,"08/03/18 05:40 PM",parts_4_cells,10,7
SRN-SAM-1328,"Asus ZenFone 5 LCD With Digitizer Assembly - Black",N/A,0,0,14.52,21.78,19.69,19.99,"08/03/18 05:41 PM",etrade_supply,26.81,26.65
SRN-SAM-1329,"Asus ZenFone 6 LCD With Digitizer Assembly - Black",N/A,0,0,19.28,27.956,25.69,21.99,"08/03/18 05:41 PM",etrade_supply,17.05,16.95
BTY-COV-1590,"Rear Housing for HTC One M8 - Glacial Silver","01/05/17 12:04 PM",0,0,11.27,17.47,15.44,19.99,"08/03/18 06:00 PM",etrade_supply,21.01,20.88
BTY-COV-1598,"Rear Housing for Samsung Galaxy Note 5 - Black Sapphire","02/09/18 04:16 PM",1,1,9.6,19.99,19.99,9.99,"08/03/18 06:00 PM",etrade_supply,25.89,25.74
BTY-COV-160,"Rear Housing Frame for Samsung Galaxy S3 i535 - White","02/16/17 04:55 PM",0,55,0,4.95,3.89,0.99,"08/03/18 06:00 PM",etrade_supply,3.24,3.22
BTY-COV-1616,"Rear Housing for Samsung Galaxy S6 Edge - Gold Platinum",N/A,0,3,16.08,23.32,21.39,11.99,"08/03/18 06:00 PM",etrade_supply,29.2,29.03
BTY-COV-1617,"Rear Housing for Samsung Galaxy S6 Edge - Black Sapphire",N/A,0,3,16.08,23.32,21.39,10.49,"08/03/18 06:00 PM",etrade_supply,29.2,29.03
BTY-COV-1618,"Rear Housing for Samsung Galaxy S6 Edge - White Pearl",N/A,0,5,20.75,29.05,26.99,11.49,"08/03/18 06:00 PM",etrade_supply,30.35,30.17
BTY-COV-1640,"Front Bezel Frame for LG G3 - Black","01/09/17 03:24 PM",0,46,5.3,9.35,7.89,8.99,"08/03/18 06:00 PM",etrade_supply,9.2,9.14
BTY-COV-1642,"Front Bezel Frame for LG G3 - White","01/24/17 12:39 PM",0,4,4.9,9.35,7.89,0,"08/03/18 06:00 PM",etrade_supply,9.2,9.14
BTY-COV-1645,"Midframe Chassis for Samsung Galaxy Note 4 N910A N910T - Black",N/A,0,0,0,14.99,0,10.99,"08/03/18 06:01 PM",etrade_supply,12.88,12.8
BTY-COV-1646,"Midframe Chassis for Samsung Galaxy Note 4 N910A N910T - White",N/A,0,0,0,14.99,0,5.49,"08/03/18 06:01 PM",etrade_supply,16.11,16.01
BTY-COV-1647,"Midframe Chassis for Samsung Galaxy Note 4 N910V N910P - Black","03/21/18 10:59 AM",1,3,10.93,19.99,0,14.19,"08/03/18 06:20 PM",etrade_supply,12.88,12.8
BTY-COV-1648,"Midframe Chassis for Samsung Galaxy Note 4 N910V N910P - White","02/01/18 02:18 PM",0,3,11.29,16.99,0,14.49,"08/03/18 06:20 PM",etrade_supply,16.11,16.01
BTY-COV-1656,"Rear Battery Cover for Samsung Galaxy S7 Edge - Black Onyx (Standard)","05/24/18 12:31 PM",11,21,3.11,10.21,8.79,5.89,"08/03/18 06:20 PM",parts_4_cells,10,8
BTY-COV-1657,"Rear Battery Cover for Samsung Galaxy S7 Edge - Silver Titanium (Standard)","05/31/18 12:28 PM",11,35,3.47,10.21,8.79,5.89,"08/03/18 06:20 PM",parts_4_cells,10,8
BTY-COV-1661,"Back Cover Replacement for Motorola Droid Turbo",N/A,0,0,0,14.99,0,10.99,"08/03/18 06:20 PM",etrade_supply,11.23,11.16
BTY-COV-1667,"Midframe for Galaxy S6 Edge G925V G925P - White","07/19/16 01:31 PM",0,1,17.53,25.42,23.39,9.99,"08/03/18 06:20 PM",etrade_supply,30.34,30.16
BTY-COV-1668,"Midframe Replacement for Samsung Galaxy S6 Edge G925T G925A - White","08/29/17 02:19 PM",0,2,13.2,25.42,0,0,"08/03/18 06:20 PM",etrade_supply,30.35,30.17
BTY-COV-1670,"Midframe Replacement for Samsung Galaxy S6 Edge G925T G925A - Gold",N/A,0,0,0,25.42,0,0,"08/03/18 06:20 PM",etrade_supply,29.32,29.14
BTY-COV-1680,"Midframe Bezel for Samsung Galaxy S3 i747 T999 - Black",N/A,0,9,0,9.95,0,0.99,"08/03/18 06:20 PM",etrade_supply,4.9,4.87
FLX-SAM-1397,"Stylus Pen for Samsung Galaxy Note 5 - Silver Titanium (No Logo)","07/20/18 05:01 PM",0,5,4.71,13.99,13.99,7.49,"08/03/18 06:20 PM",fixez,9.49,0
BTY-COV-1688,"BlackBerry Bold 9900 Replacement Battery Cover",N/A,0,0,0,6.99,0,2.99,"08/03/18 06:20 PM",etrade_supply,4.42,4.39
SRN-LGM-629,"LG K10 LCD and Touch Screen Digitizer with Frame K10 K420N K410 K430 MS428","06/13/18 01:48 PM",0,3,33.13,57.1863,57.1863,49.99,"08/03/18 06:21 PM",etrade_supply,58.32,57.97
BTY-COV-170,"Samsung Galaxy S4 i545 Rear Housing Frame - White","03/06/18 02:23 PM",0,2,3.48,6.91,5.49,3.99,"08/03/18 06:40 PM",etrade_supply,3.48,3.46
BTY-COV-172,"Rear Housing for Samsung Galaxy Note 2 i605  - White","12/11/17 12:12 PM",0,0,3.68,9.59,8.29,0.99,"08/03/18 06:40 PM",etrade_supply,6.46,6.42
BTY-COV-182,"Rear Housing for Samsung Galaxy Note 2 i605 - Gray","11/30/15 01:02 PM",0,0,5.33,9.59,8.29,0.99,"08/03/18 06:40 PM",etrade_supply,6.46,6.42
BTY-COV-228,"Motorola Atrix HD MB886 Back Housing",N/A,0,0,0,8.95,4.99,2.89,"08/03/18 06:40 PM",etrade_supply,3.06,3.04
BTY-COV-230,"Motorola Atrix HD MB886 Front Frame - Black",N/A,0,0,0,8.95,3.99,2.89,"08/03/18 06:40 PM",etrade_supply,3.06,3.04
BTY-COV-312,"Motorola Droid M XT907 Front Lower Trim Frame Cover - White",N/A,0,0,0,5.95,3.99,1.49,"08/03/18 07:00 PM",etrade_supply,1.61,1.6
BTY-COV-370,"HTC ONE SV Back Battery Door Cover Red",N/A,0,8,0,4.95,0,0.49,"08/03/18 07:00 PM",etrade_supply,5.22,5.19
BTY-COV-372,"HTC ONE SV Back Housing",N/A,0,27,0,9.95,0,0.49,"08/03/18 07:00 PM",etrade_supply,0,4.4
BTY-COV-374,"Motorola MOTO X XT1060 Midframe Housing Upper",N/A,0,3,0,9.95,0,0.49,"08/03/18 07:00 PM",etrade_supply,6.59,6.55
BTY-COV-376,"Motorola MOTO X XT1060 Midframe Housing Lower",N/A,0,3,0,7.95,0,0.49,"08/03/18 07:00 PM",etrade_supply,10.56,10.5
BTY-COV-380,"Motorola MOTO X XT1060 Back Battery Door Cover Black",N/A,0,0,0,11.95,0,1.99,"08/03/18 07:00 PM",etrade_supply,4.43,4.4
BTY-COV-402,"Samsung Galaxy S2 EPIC 4G D710 Rear Housing",N/A,0,19,0,8.95,0,0.49,"08/03/18 07:00 PM",etrade_supply,3,2.98
BTY-COV-440,"Midframe Bezel for Samsung Galaxy S3 i535 R530 - Brown",N/A,0,27,0,7.95,4.99,0.99,"08/03/18 07:00 PM",etrade_supply,4.85,4.82
BTY-COV-442,"Midframe Bezel for Samsung Galaxy S3 i535 R530 - Black",N/A,0,7,0,7.95,5.99,0.99,"08/03/18 07:00 PM",etrade_supply,1.74,1.73
SRN-NOK-066,"LCD + Touch Screen Digitizer with Frame for Nokia Lumia 1020 Black","11/02/17 03:22 PM",0,1,51.39,70.42,64.19,79.97,"08/03/18 07:00 PM",etrade_supply,67.17,66.77
SRN-NOK-072,"LCD + Touch Screen Digitizer for Nokia Lumia 925 Black","07/13/16 11:32 AM",0,6,34.63,48.3,48.3,49.99,"08/03/18 07:00 PM",etrade_supply,49.35,49.05
SRN-NOK-072,"LCD + Touch Screen Digitizer for Nokia Lumia 925 Black","07/13/16 11:32 AM",0,6,34.63,48.3,48.3,49.99,"08/03/18 07:00 PM",parts_4_cells,50,30
SRN-NOK-082,"Touch Screen Digitizer for Nokia Lumia 520 Black","05/28/15 12:44 PM",0,5,5.9,10.62,9.19,5.99,"08/03/18 07:00 PM",etrade_supply,5.22,5.19
SRN-NOK-084,"Touch Screen Digitizer for Nokia Lumia 625 Black","09/15/15 01:48 PM",0,6,5.84,10.512,9.09,3.99,"08/03/18 07:01 PM",etrade_supply,5.8,5.77
SRN-NOK-086,"Touch Screen Digitizer for Nokia Lumia 820 Black","03/28/16 12:37 PM",0,4,4.19,9.54,8.29,4.49,"08/03/18 07:01 PM",etrade_supply,10.19,10.13
SRN-NOK-088,"Touch Screen Digitizer for Nokia Lumia 920 Black","07/10/17 01:59 PM",0,2,6.22,11.2525,9.49,6.49,"08/03/18 07:01 PM",etrade_supply,10.96,10.89
SRN-NOK-153,"Nokia Lumia 1520 LCD With Digitizer Assembly","10/05/17 01:31 PM",0,1,39.65,53.64,48.76,47.49,"08/03/18 07:20 PM",etrade_supply,45.75,45.48
SRN-NOK-153,"Nokia Lumia 1520 LCD With Digitizer Assembly","10/05/17 01:31 PM",0,1,39.65,53.64,48.76,47.49,"08/03/18 07:20 PM",parts_4_cells,55,35
SRN-NOK-165,"LCD and Touch Screen Digitizer for Nokia Lumia 925 - Black",N/A,0,0,0,49.99,0,0,"08/03/18 07:20 PM",parts_4_cells,50,30
SRN-NOK-165,"LCD and Touch Screen Digitizer for Nokia Lumia 925 - Black",N/A,0,0,0,49.99,0,0,"08/03/18 07:20 PM",etrade_supply,49.35,49.05
SRN-SAM-036,"LCD and Touch Screen Digitizer for Samsung Galaxy Nexus - Black","05/06/15 10:49 AM",0,3,66.51,89.7885,49.99,48.99,"08/03/18 07:20 PM",etrade_supply,65.53,65.14
SRN-SAM-042,"LCD and Touch Screen Digitizer With Frame for Samsung Galaxy Note 2 i317 T889 - Gray","02/20/17 01:27 PM",0,0,70.08,99.99,56.59,56.59,"08/03/18 07:20 PM",etrade_supply,61.03,60.67
SRN-SAM-043,"LCD and Touch Screen Digitizer With Frame for Samsung Galaxy Note 2 i605 L900 - Gray","06/05/17 02:22 PM",0,0,52.33,99.99,99.99,56.59,"08/03/18 07:20 PM",etrade_supply,67.29,66.89
BTY-COV-462,"Midframe Bezel for Samsung Galaxy S3 i9300 - Blue",N/A,0,9,0,6.95,0,0.99,"08/03/18 07:20 PM",parts_4_cells,8,7
BTY-COV-468,"Midframe Bezel for Samsung Galaxy S3 i9300 - Silver",N/A,0,4,0,6.95,0,0.99,"08/03/18 07:20 PM",etrade_supply,5.73,5.7
BTY-COV-468,"Midframe Bezel for Samsung Galaxy S3 i9300 - Silver",N/A,0,4,0,6.95,0,0.99,"08/03/18 07:21 PM",parts_4_cells,8,7
BTY-COV-474,"Midframe Bezel for Samsung Galaxy Note 3 N900P N900V  - Silver","07/05/18 04:13 PM",0,5,4.06,9.36,8.09,4.99,"08/03/18 07:21 PM",parts_4_cells,8,0
BTY-COV-476,"Rear Housing for Samsung Galaxy Note 2 N7105 LTE - Gray",N/A,0,0,0,9.95,0,2.99,"08/03/18 07:21 PM",etrade_supply,7.23,7.19
BTY-COV-478,"Rear Housing With Black Lens for Samsung Galaxy Note 3 N900A ATT  Black ","01/09/17 04:49 PM",0,2,5.67,10.73,9.29,0,"08/03/18 07:40 PM",etrade_supply,6.45,6.41
BTY-COV-480,"Rear Housing With White Lens for Samsung Galaxy Note 3 N900A N900T  Black ","06/19/17 03:17 PM",0,1,4.94,11.27,9.49,0,"08/03/18 07:40 PM",etrade_supply,6.45,6.41
BTY-COV-494,"HTC Inspire Back Battery Door Cover","03/25/15 01:12 PM",0,0,2.63,5.9175,4.39,0,"08/03/18 07:40 PM",etrade_supply,2.69,2.67
BTY-COV-504,"Rear Housing for Samsung Galaxy S5 - White","05/31/18 12:28 PM",0,3,3.79,9.99,7.79,4.99,"08/03/18 07:40 PM",etrade_supply,10,9.94
BTY-COV-514,"Midframe Bezel for Samsung Galaxy S4 Mini - White",N/A,0,7,0,11.95,0,0.99,"08/03/18 07:40 PM",etrade_supply,5.82,5.79
BTY-COV-514,"Midframe Bezel for Samsung Galaxy S4 Mini - White",N/A,0,7,0,11.95,0,0.99,"08/03/18 08:00 PM",cell_parts_hub,0,9.99
BTY-COV-516,"Samsung Galaxy S4 Mini i9195 Rear Housing White",N/A,0,3,0,7.95,0,0.99,"08/03/18 08:00 PM",etrade_supply,4.89,4.86
BTY-COV-522,"Midframe Bezel for Samsung Galaxy S3 Mini - White","09/01/16 12:00 PM",0,0,2.58,7.791,6.19,0,"08/03/18 08:00 PM",etrade_supply,4.9,4.87
BTY-COV-526,"Samsung Galaxy S3 Mini i8190 Rear Housing White",N/A,0,8,0,5.95,0,0.99,"08/03/18 08:00 PM",etrade_supply,4.25,4.22
BTY-COV-536,"Sony Xperia Z1 L39h Front Housing - White",N/A,0,7,0,7.95,0,0.99,"08/03/18 08:00 PM",etrade_supply,4.43,4.4
BTY-COV-540,"Sony Xperia Z1 L39h Battery Door with Xperia Logo White","12/18/15 12:18 PM",0,0,1.87,6.35,4.69,0,"08/03/18 08:00 PM",etrade_supply,3.8,3.78
BTY-COV-540,"Sony Xperia Z1 L39h Battery Door with Xperia Logo White","12/18/15 12:18 PM",0,0,1.87,6.35,4.69,0,"08/03/18 08:01 PM",cell_parts_hub,9.88,0
BTY-COV-542,"Sony Xperia Z1 L39h Rear Housing - Black","05/30/17 03:57 PM",0,0,2.42,5.78,4.29,0,"08/03/18 08:01 PM",etrade_supply,5.22,5.19
BTY-COV-544,"Sony Xperia Z1 L39h Rear Housing - White",N/A,0,0,0,6.95,0,0,"08/03/18 08:01 PM",etrade_supply,5.22,5.19
BTY-COV-546,"Sony Xperia Z L36h Front Housing - Black",N/A,1,5,0,8.95,0,0.99,"08/03/18 08:01 PM",etrade_supply,4.43,4.4
BTY-COV-548,"Sony Xperia Z L36h Front Housing - White",N/A,0,9,0,8.95,0,0.99,"08/03/18 08:01 PM",etrade_supply,4.43,4.4
BTY-COV-560,"Sony Xperia Z1 L39h Front Housing - Purple",N/A,0,4,0,7.95,0,0.99,"08/03/18 08:01 PM",etrade_supply,5.86,5.82
BTY-COV-562,"Sony Xperia Z1 L39h Front Housing Bezel - Black",N/A,0,6,0,7.95,0,0.99,"08/03/18 08:01 PM",etrade_supply,4.43,4.4
BTY-COV-572,"Battery Cover with NFC-QI Wireless Charging Patch for LG G3 D850 AT&T - Black","09/16/15 12:52 PM",0,0,6.63,11.6025,9.79,0,"08/03/18 08:01 PM",etrade_supply,7.88,7.83
BTY-COV-576,"Battery Cover with NFC-QI Wireless Charging Patch for LG G3 D850 AT&T - White","01/18/16 10:44 AM",0,0,6.42,11.85,9.99,0,"08/03/18 08:20 PM",etrade_supply,9.62,9.56
BTY-COV-580,"Battery Cover with NFC-QI Wireless Charging Verizon for LG G3 VS985 - White","03/25/15 01:12 PM",0,0,11.57,17.9335,15.89,0,"08/03/18 08:20 PM",etrade_supply,10.56,10.5
BTY-COV-604,"Back Battery Door Cover with Camera Lens for HTC One M8 831C Gunmetal Gray","12/10/15 01:52 PM",0,0,16.94,24.56,22.59,0,"08/03/18 08:20 PM",etrade_supply,21.01,20.88
BTY-COV-608,"Rear Housing Frame with Loudspeaker Headphone Jack for Samsung Galaxy S5","07/20/18 05:01 PM",0,3,2.89,11.34,9.59,5.99,"08/03/18 08:20 PM",etrade_supply,7.16,7.12
BTY-COV-610,"Back Battery Door Cover with Volume Power Buttons for HTC One M7 801e Silver","06/06/16 03:54 PM",0,0,7.42,13.787,11.19,1.99,"08/03/18 08:20 PM",etrade_supply,21.01,20.88
BTY-HTC-006,"HTC Amaze 4G BG86100 Replacement Battery",N/A,0,0,0,6.95,2.99,0,"08/03/18 08:40 PM",etrade_supply,7.29,7.25
BTY-HTC-036,"HTC Desire S Freestyle BB96100 Replacement Battery",N/A,0,37,0,6.95,2.99,0,"08/03/18 08:40 PM",etrade_supply,7.29,7.25
BTY-HTC-042,"HTC Hero S BH11100 Replacement Battery",N/A,0,1,0,6.95,2.99,0,"08/03/18 08:40 PM",etrade_supply,9.16,9.11
BTY-HTC-092,"HTC Wildfire S BD29100 Battery",N/A,0,155,0,11.95,2.99,0.99,"08/03/18 08:40 PM",etrade_supply,3.67,3.65
BTY-HTC-096,"Replacement Battery for HTC Raider 4G Holiday X710E G19 G20","02/18/15 04:23 PM",0,36,0,12.95,4.99,0,"08/03/18 08:40 PM",etrade_supply,8.4,8.35
BTY-LG-052,"LG Optimus G Pro E980 E985 F240K BL-48TH Replacement Battery 4000 mAH",N/A,0,0,0,19.95,4.99,0,"08/03/18 08:40 PM",etrade_supply,10.96,10.89
SRN-MOT-638,"Motorola Moto E 2nd Gen XT1505 XT1511 XT1524 XT1527 XT1528 LCD With Digitizer - Black","05/11/18 01:24 PM",0,5,13.99,21.02,18.99,16.99,"08/03/18 08:40 PM",etrade_supply,20.5,20.38
SRN-MOT-641,"Motorola Moto G XT1031 XT1032 XT1033 LCD Touch Screen Assembly w/ Frame Black","12/19/17 03:54 PM",0,0,18.12,31.7,29.49,20.99,"08/03/18 08:40 PM",etrade_supply,30.24,30.06
SRN-MOT-655,"LCD and Touch Screen Digitizer for Droid Maxx 2 with Frame - Black","06/13/18 01:48 PM",1,2,17.48,39.99,39.99,31.49,"08/03/18 08:40 PM",parts_4_cells,30,25
SRN-MOT-656,"LCD and Touch Screen Digitizer for Droid Maxx 2 with Frame - White","12/21/16 04:24 PM",0,0,30.09,42.96,42.96,32.29,"08/03/18 08:40 PM",parts_4_cells,30,25
SRN-MOT-660,"LCD and Touch Screen Digitizer for Motorola Moto Z Droid XT1650-01 - Black","05/22/18 12:38 PM",1,7,87.19,137.96,137.96,95.59,"08/03/18 08:40 PM",etrade_supply,115.73,115.04
SRN-MOT-664,"LCD and Digitizer Replacement with Frame for Motorola Google Nexus 6","06/13/18 01:48 PM",0,5,70.68,141.83,132.93,107.29,"08/03/18 08:40 PM",parts_4_cells,115,80
SRN-MOT-666,"LCD and Digitizer Replacement for Droid Maxx 2 XT1565 - Black","04/09/18 04:29 PM",0,2,22.56,42.99,0,26.29,"08/03/18 08:40 PM",etrade_supply,43.39,43.13
SRN-MOT-667,"LCD and Digitizer Replacement for Droid Maxx 2 XT1565 - White",N/A,0,0,0,42.99,0,28.99,"08/03/18 08:40 PM",etrade_supply,43.38,43.12
SRN-MOT-668,"LCD and Digitizer Replacement for Droid Ultra Maxx XT1080 XT1080M",N/A,0,0,0,49.99,0,40.99,"08/03/18 08:40 PM",etrade_supply,57.1,56.76
SRN-MOT-669,"LCD and Digitizer Replacement for Motorola Moto G3 - Black",N/A,0,0,0,28.99,0,18.99,"08/03/18 08:41 PM",etrade_supply,26.92,0
SRN-MOT-670,"LCD and Digitizer Replacement for Motorola Moto G3 - White",N/A,0,0,0,28.99,0,18.99,"08/03/18 08:41 PM",etrade_supply,26.84,26.68
SRN-MOT-673,"LCD and Touch Screen Digitizer for Motorola Moto E XT1021 XT1022 XT1025 - Black",N/A,0,0,0,20.99,0,16.09,"08/03/18 09:00 PM",etrade_supply,22.93,22.79
SRN-MOT-674,"LCD and Digitizer Replacement with Frame for Motorola Moto X Pure Edition XT1575 - Black","12/21/16 01:09 PM",0,0,0,56.95,0,43.99,"08/03/18 09:00 PM",etrade_supply,57.62,57.28
SRN-MOT-675,"LCD and Digitizer Replacement with Frame for Motorola Moto X Pure Edition XT1575 - White",N/A,0,0,38.47,89.99,0,47.89,"08/03/18 09:00 PM",etrade_supply,57.62,57.28
SRN-MOT-676,"LCD and Digitizer Replacement with Frame for Motorola Moto X Play - Black",N/A,0,0,0,49.99,0,32.99,"08/03/18 09:00 PM",etrade_supply,40.38,40.14
SRN-MOT-677,"LCD and Digitizer Replacement with Frame for Motorola Moto X Play - White",N/A,0,0,0,49.99,0,32.99,"08/03/18 09:00 PM",etrade_supply,40.39,40.15
SRN-MOT-678,"LCD and Digitizer Replacement with Frame for Motorola Moto X (2nd Gen) - Black","03/06/18 02:23 PM",0,4,51.74,134.99,0,94.99,"08/03/18 09:00 PM",etrade_supply,62.19,61.82
