SKU,Title,"Last Received","30 Days Item Sale",Quantity,"True Cost",D1,P1,"Sale Price","Date Updated",Competitor,"Previous Price",Price
FLX-MOT-518,"Front Camera Replacement for Motorola Droid Turbo","09/27/17 02:06 PM",0,3,4.79,9.07,7.89,0.99,"01/13/19 06:40 AM",etrade_supply,16.88,17.14
SRN-LGM-643,"LCD and Touch Screen Digitizer with Frame for LG G3 - White","05/04/18 03:36 PM",0,0,27.55,59.2213,59.22,31.49,"01/13/19 06:40 AM",etrade_supply,75.25,76.39
FLX-NOK-032,"Nokia Lumia 925 Sim Card Tray Holder Slot - Black","08/26/15 04:44 PM",0,1,2.69,6.0525,4.49,0.99,"01/13/19 06:41 AM",etrade_supply,1.72,1.75
FLX-NOK-036,"Nokia Lumia 1020 Micro USB Charging Port Flex Cable","01/17/17 02:58 PM",0,5,2.51,5.94,4.39,0.99,"01/13/19 06:41 AM",etrade_supply,2.66,2.7
FLX-NOK-040,"Nokia Lumia 1020 Sim Card Tray Holder Slot - Yellow",N/A,0,0,0,6.95,4.19,1.49,"01/13/19 06:41 AM",etrade_supply,2.44,2.48
FLX-NOK-046,"Nokia Lumia 1520 Sim Card Tray Holder Slot - Black","01/05/16 02:21 PM",0,3,4.23,8.284,6.99,0.99,"01/13/19 06:41 AM",etrade_supply,5.13,5.21
FLX-NOK-050,"Nokia Lumia 920 Sim Card Tray Holder Black","05/13/15 01:39 PM",0,1,0,5.95,0,0.99,"01/13/19 06:41 AM",etrade_supply,1.76,1.79
FLX-NOK-052,"Nokia Lumia 1520 Sim Card Tray Holder Black","07/28/16 04:58 PM",0,0,1.1,3.144,2.49,0.99,"01/13/19 06:41 AM",etrade_supply,5.13,5.21
FLX-SAM-096,"Sim Card Memory Card Flex Cable for Samsung Galaxy Note 2 N7100 ",N/A,0,6,0,5.95,3.19,2.99,"01/13/19 07:00 AM",etrade_supply,3.29,3.34
FLX-SAM-1004,"Home Button for Samsung Galaxy S4 Mini - Black",N/A,0,7,0,2.95,0,0.99,"01/13/19 07:00 AM",etrade_supply,0.83,0.84
FLX-SAM-1010,"Loud Speaker module for Samsung Galaxy S4 Mini","11/30/16 01:32 PM",0,0,1.71,4.232,3.49,0.99,"01/13/19 07:00 AM",etrade_supply,1.72,1.75
FLX-SAM-1020,"Home Button for Samsung Galaxy S3 Mini - White",N/A,0,3,0,3.95,0,0.99,"01/13/19 07:00 AM",etrade_supply,0.85,0.86
FLX-SAM-1034,"Rear Camera for Samsung Galaxy S4","12/27/17 03:12 PM",0,2,1.98,9.432,8.19,2.49,"01/13/19 07:00 AM",etrade_supply,4.83,4.9
FLX-SAM-1036,"Power Volume for Samsung Galaxy S3 - Gray","11/19/15 12:09 PM",0,5,1.16,2.616,2.09,0.99,"01/13/19 07:00 AM",etrade_supply,0.85,0.86
FLX-SAM-1044,"Samsung Galaxy Note 10.1 N8000 Rev 0.1 USB Charging Port Flex Cable",N/A,0,9,0,9.95,0,0,"01/13/19 07:00 AM",etrade_supply,4.86,4.93
FLX-SAM-1263,"USB Charging Port for Samsung Galaxy Nexus",N/A,0,100,0,2.95,0,0.99,"01/13/19 07:01 AM",etrade_supply,3.86,3.92
FLX-SAM-1264,"USB Charging Port Flex Cable for Samsung Galaxy Note 2 N7100 ",N/A,0,92,0,2.95,0,1.99,"01/13/19 07:01 AM",etrade_supply,0.85,0.86
FLX-SAM-1265,"Charging Port for Samsung Galaxy Tab 3 10.1 GT P5210 (Wifi Version) ","01/10/17 01:01 PM",0,0,1.27,2.424,1.89,0.79,"01/13/19 07:20 AM",etrade_supply,4.87,4.94
FLX-SAM-1292,"Charging Port Flex Cable for Samsung Galaxy S6 Edge G925F","07/27/18 04:39 PM",1,8,4.59,12.99,7.94,6.49,"01/13/19 07:20 AM",etrade_supply,9.98,10.14
FLX-SAM-1295,"Keyboard Touch Sensor Home Button Flex Cable for Samsung Galaxy Note Edge SM-N915A SM-N915T ","11/19/15 12:09 PM",0,8,2.38,5.95,0,0,"01/13/19 07:20 AM",etrade_supply,3.49,3.55
FLX-SAM-1296,"Rear Camera for Samsung Galaxy Note 4","07/05/18 04:13 PM",0,3,2.5,11.76,11.76,3.29,"01/13/19 07:20 AM",etrade_supply,4.81,4.88
FLX-SAM-1297,"Earpiece Speaker for Samsung Galaxy Note 4","03/23/18 03:25 PM",0,16,0.73,2.4,2.09,1.49,"01/13/19 07:20 AM",etrade_supply,1.03,1.04
FLX-SAM-1302,"Wifi Antenna  for Samsung Galaxy Note 4","10/19/16 09:33 AM",0,13,1.03,2.95,0,1.49,"01/13/19 07:20 AM",etrade_supply,2.07,2.11
FLX-SAM-1311,"Micro USB Charging Port Cover Samsung Galaxy S5 - Silver","10/05/17 01:31 PM",0,5,0.41,1.23,0.79,0,"01/13/19 07:20 AM",etrade_supply,0.93,0.94
FLX-SAM-1315,"Front Camera for Samsung Galaxy Note 4","03/15/18 01:59 PM",0,3,1.34,5.0625,3.79,1.69,"01/13/19 07:20 AM",etrade_supply,2.77,2.81
FLX-SAM-1317,"Power Button Vibration Motor Flex Cable for Samsung Galaxy Note 4","10/18/18 11:57 AM",0,8,0.92,4.6575,3.49,1.79,"01/13/19 07:20 AM",etrade_supply,1.71,1.74
FLX-SAM-1320,"Loudspeaker for Samsung Galaxy Note 4","06/23/17 04:35 PM",0,6,1.04,4.14,3.39,2.49,"01/13/19 07:20 AM",etrade_supply,1.71,1.74
FLX-SAM-1322,"Sim Card SD Card Tray Flex Cable for Samsung Galaxy Note 4","10/10/18 04:00 PM",0,3,1.32,4.09,3.29,1.99,"01/13/19 07:21 AM",etrade_supply,3.1,3.14
FLX-SAM-1324,"Front Camera for Samsung Galaxy Note Edge",N/A,0,2,2.07,4.6575,3.49,0,"01/13/19 07:40 AM",etrade_supply,2.77,2.81
FLX-SAM-1325,"Headphone Jack Flex Cable for Samsung Galaxy Note Edge ","01/17/17 02:58 PM",0,1,1.78,4.09,3.29,0.99,"01/13/19 07:40 AM",etrade_supply,3.55,3.61
FLX-SAM-1326,"Rear Camera for Samsung Galaxy Note Edge","05/16/18 02:40 PM",0,4,3.08,12.1975,10.29,4.99,"01/13/19 07:40 AM",etrade_supply,4.81,4.88
FLX-SAM-1331,"Earpiece Speaker for Samsung Galaxy Note Edge","03/01/17 12:08 PM",0,3,0.94,3,2.39,0,"01/13/19 07:40 AM",etrade_supply,1.03,1.04
FLX-SAM-1335,"Samsung Galaxy S6 G920 Front Camera ",N/A,0,3,3.7,7.77,6.19,0,"01/13/19 07:40 AM",etrade_supply,1.72,1.75
FLX-SAM-1336,"Samsung Galaxy S6 G920 Earpiece ","03/07/18 03:39 PM",0,0,1.19,4.99,3.99,1.59,"01/13/19 07:40 AM",etrade_supply,2.79,2.83
FLX-SAM-1343,"Rear Camera Lens for Samsung Galaxy S6 Edge - White Pearl","06/13/18 01:48 PM",0,3,0.89,2.4,2.09,1.99,"01/13/19 07:40 AM",etrade_supply,0.66,0.67
FLX-SAM-1344,"Volume Flex Cable for Samsung Galaxy S6 Edge","12/04/18 03:51 PM",0,5,1.09,4.6575,3.49,1.99,"01/13/19 07:41 AM",etrade_supply,1.73,1.76
FLX-SAM-1345,"Antenna Signal Cable for Samsung Galaxy S6 Edge","05/08/18 03:18 PM",0,1,1.03,3,2.39,1.29,"01/13/19 07:41 AM",etrade_supply,2.06,2.1
FLX-SAM-1346,"Charging Port Flex Cable for Samsung Galaxy S6 Edge G925V","10/24/18 04:07 PM",1,7,3.67,9.99,7.49,5.59,"01/13/19 08:00 AM",etrade_supply,7.11,7.21
FLX-SAM-1347,"Home Button Flex Cable for Samsung Galaxy S6 Edge - White Pearl","01/29/18 01:44 PM",0,3,2.46,6.99,4.79,3.79,"01/13/19 08:00 AM",etrade_supply,4.8,4.87
FLX-SAM-1348,"Power Flex Cable for Samsung Galaxy S6 Edge","04/20/17 01:14 PM",0,5,1.03,4.6575,4.6575,1.29,"01/13/19 08:00 AM",etrade_supply,1.37,1.39
FLX-SAM-1350,"Sim Card Tray for Samsung Galaxy S6 - Silver","05/10/18 04:59 PM",0,3,0.63,2.25,1.89,0.99,"01/13/19 08:00 AM",etrade_supply,0.85,0.86
FLX-SAM-1355,"Charging Port Flex Cable for Samsung Galaxy S6 Edge G925A","10/11/18 09:47 AM",0,9,4.06,9.99,7.54,5.59,"01/13/19 08:00 AM",etrade_supply,7.12,7.22
FLX-SAM-1356,"Charging Port Flex Cable for Samsung Galaxy S6 Edge G925T","05/31/18 10:42 AM",1,4,4.24,10.99,8.19,5.99,"01/13/19 08:00 AM",etrade_supply,7.12,7.22
FLX-SAM-1357,"Charging Port Flex Cable for Samsung Galaxy S6 Edge G925P","05/09/18 03:52 PM",0,5,5.88,9.99,0,5.59,"01/13/19 08:01 AM",etrade_supply,7.11,7.21
FLX-SAM-1358,"Loudspeaker for Samsung Galaxy S4 i545/L720 (Verizon/Sprint)",N/A,0,2,3,6.75,4.99,1.99,"01/13/19 08:01 AM",etrade_supply,1.74,1.77
FLX-SAM-1360,"Loudspeaker for Samsung Galaxy S5","09/08/17 12:45 PM",1,3,0.6,4.347,3.59,0.99,"01/13/19 08:20 AM",etrade_supply,0.76,0.77
FLX-SAM-1362,"Earpiece Speaker for Samsung Galaxy S5 ","03/28/17 11:27 AM",0,8,1.02,1.875,1.59,1.39,"01/13/19 08:20 AM",etrade_supply,0.72,0.73
FLX-SAM-1366,"Sim Card Tray for Samsung Galaxy S6 Edge Plus  - Gold","08/15/17 01:50 PM",0,2,2.01,6.1,4.49,2.49,"01/13/19 08:20 AM",etrade_supply,0.85,0.86
FLX-SAM-1372,"Earpiece Speaker for Samsung Galaxy S6 Edge Plus ","05/02/16 11:58 AM",0,2,1.49,3.68,2.99,1.89,"01/13/19 08:40 AM",etrade_supply,1.72,1.75
FLX-SAM-1380,"Sim Card Tray for Samsung Galaxy Note 5 ","12/04/18 03:51 PM",0,5,0.94,3.98,3.2,1.99,"01/13/19 08:40 AM",etrade_supply,1.22,1.24
FLX-SAM-1403,"Rear Camera Lens for Samsung Galaxy S6 Edge - Black Sapphire","10/11/18 09:47 AM",0,3,0.71,3.53,2.79,1.99,"01/13/19 08:40 AM",etrade_supply,0.66,0.67
FLX-SAM-1404,"Rear Camera Lens for Samsung Galaxy S6 Edge - Gold Platinum","07/05/18 04:13 PM",0,5,0.79,3.38,2.69,1.49,"01/13/19 08:40 AM",etrade_supply,0.66,0.67
FLX-SAM-1412,"Sim Card Tray for Samsung Galaxy S6 Edge - White","01/24/18 11:42 AM",0,7,1.19,2.784,2.19,1.49,"01/13/19 09:00 AM",etrade_supply,0.83,0.84
FLX-SAM-1413,"Sim Card Tray for Samsung Galaxy S6 Edge - Gold","10/16/17 03:29 PM",0,2,1.95,2.784,2.19,2.39,"01/13/19 09:00 AM",etrade_supply,0.83,0.84
FLX-SAM-1416,"Home Button for Samsung Galaxy Note 5 - White Pearl","10/16/17 04:38 PM",0,3,7.7,21.99,16.09,11.59,"01/13/19 09:00 AM",etrade_supply,12.8,13
FLX-SAM-746,"Charging Port Flex Cable for Samsung Galaxy Note 2 I317 N7105  Rev 0.7 1.0","01/17/17 02:58 PM",0,0,2.51,5.65,4.14,0.99,"01/13/19 09:00 AM",etrade_supply,4.87,4.94
FLX-SAM-1422,"Rear Camera Lens for Samsung Galaxy S7 Edge - Black Onyx","10/11/18 09:47 AM",0,8,0.75,2.95,2.95,1.19,"01/13/19 09:01 AM",etrade_supply,0.93,0.94
FLX-SAM-1425,"Loudspeaker for Samsung Galaxy S6 Edge Plus","07/31/18 10:50 AM",0,10,1.67,4.84,3.59,1.99,"01/13/19 09:20 AM",etrade_supply,1.71,1.74
FLX-SAM-1436,"USB Charging Port Cover for Samsung Galaxy S5 - Gold","12/02/16 03:29 PM",0,6,0.4,1.23,0.79,0,"01/13/19 09:20 AM",etrade_supply,1.19,1.21
FLX-SAM-1444,"Charging Port Flex Cable for Samsung Galaxy S7 Edge G935F","07/20/18 05:01 PM",0,9,2.43,15.99,7.99,7.99,"01/13/19 09:20 AM",etrade_supply,7.11,7.21
FLX-SAM-1445,"Charging Port Flex Cable for Samsung Galaxy S7 Edge G935A","08/15/18 12:53 PM",0,4,3.17,15.99,4.39,4.39,"01/13/19 09:20 AM",etrade_supply,8.46,8.59
FLX-SAM-1447,"Charging Port Flex Cable for Samsung Galaxy S6 Edge Plus G928P","06/13/18 01:48 PM",0,6,3.39,11.89,8.09,6.49,"01/13/19 09:21 AM",etrade_supply,5.73,5.82
FLX-SAM-1449,"Charging Port Flex Cable for Samsung Galaxy Note 4 N910V","12/27/18 01:50 PM",2,2,2.82,6.99,7.59,3.19,"01/13/19 09:21 AM",etrade_supply,6.41,6.51
FLX-SAM-1451,"Charging Port Flex Cable for Samsung Galaxy Note 4 N910A","12/13/18 01:38 PM",0,4,3.1,8.99,6.59,4.29,"01/13/19 09:40 AM",etrade_supply,6.4,6.5
FLX-SAM-1456,"Home Button Flex Cable for Samsung Galaxy Grand Prime",N/A,0,2,1.17,2.81,2.19,0.99,"01/13/19 09:40 AM",etrade_supply,1.04,1.05
FLX-SAM-1459,"Charging Port Flex Cable for Samsung Galaxy Note Edge N915T",N/A,0,0,4.41,12.99,7.59,6.89,"01/13/19 09:40 AM",etrade_supply,7.12,7.22
FLX-SAM-1460,"Home Button Flex Cable for Samsung Galaxy S6 Edge - Black Sapphire","01/29/18 01:44 PM",0,4,2.46,8.99,3.59,4.09,"01/13/19 09:40 AM",etrade_supply,4.8,4.87
FLX-SAM-1461,"Earpiece Speaker for Samsung Galaxy S6 Edge","07/20/18 05:01 PM",0,7,1.52,6.99,2.19,3.09,"01/13/19 09:40 AM",etrade_supply,3.87,3.93
FLX-SAM-1462,"Sim Card Tray for Samsung Galaxy S6 Edge - Black","12/04/18 03:51 PM",0,4,0.94,2.81,2.19,1.49,"01/13/19 09:40 AM",etrade_supply,0.83,0.84
FLX-SAM-1463,"Vibration Motor for Samsung Galaxy S6 Edge Plus",N/A,0,2,1.94,4.46,4.46,2.49,"01/13/19 09:40 AM",etrade_supply,0.69,0.7
FLX-SAM-1465,"Charging Port Flex Cable for Samsung Galaxy S6 Edge Plus G928P","12/27/17 03:12 PM",0,4,3.96,8.99,7.59,5.89,"01/13/19 09:40 AM",etrade_supply,7.12,7.22
FLX-SAM-1476,"Charging Port Flex Cable for Samsung Galaxy S5 G900F","12/04/18 03:51 PM",0,5,3.28,7.77,6.11,4.49,"01/13/19 09:41 AM",etrade_supply,7.11,7.21
FLX-SAM-1489,"Charging Port Flex Cable for Samsung Galaxy S5 G900H","08/24/17 02:40 PM",2,4,3.88,9.37,7.89,4.99,"01/13/19 10:00 AM",etrade_supply,7.12,7.22
SRN-LGM-677,"LCD and Touch Screen Digitizer with Frame for LG G3 - Gold","05/04/18 03:36 PM",0,2,36.16,59.2213,0,51.19,"01/13/19 10:00 AM",etrade_supply,33.4,33.9
SRN-LGM-681,"LG Optimus G LS970 LCD Screen Touch Screen Digitizer with Frame","12/19/17 03:54 PM",0,2,0,49.99,0,37.49,"01/13/19 10:00 AM",etrade_supply,46.76,47.47
SRN-MOT-422,"Motorola Moto G XT1032 XT1036 LCD Touch Screen Digitizer Assembly","08/22/16 10:30 AM",0,2,24,33.91,31.49,21.49,"01/13/19 10:00 AM",etrade_supply,24.68,25.05
SRN-MOT-426,"LCD Screen and Digitizer Assembly for Motorola Moto E XT1021 XT1022 No Logo Black","10/16/17 03:31 PM",0,1,14.93,20.99,16.09,16.09,"01/13/19 10:00 AM",etrade_supply,22.75,23.09
SRN-MOT-440,"LCD and Touch Screen Digitizer for Motorola Moto E XT1021 XT1022 XT1025 - White",N/A,0,9,0,20.99,0,16.09,"01/13/19 10:00 AM",etrade_supply,19.14,19.44
SRN-MOT-442,"LCD + Touch Screen Digitizer for Motorola Droid Mini XT1030 Black","03/20/18 03:49 PM",1,1,10.17,23.81,21.89,14.69,"01/13/19 10:00 AM",etrade_supply,28.96,29.4
SRN-MOT-456,"LCD + Touch Screen Digitizer with Frame for Motorola Droid Razr M XT907 Black","02/26/16 11:30 AM",0,0,18.02,26.13,23.99,0,"01/13/19 10:00 AM",etrade_supply,23.93,24.29
FLX-SAM-1492,"Charging Port for Samsung Galaxy Tab Pro 8.4 T320 ","06/13/18 01:48 PM",0,5,1.67,4.91,3.69,2.49,"01/13/19 10:00 AM",etrade_supply,3.47,3.53
FLX-SAM-1503,"Rear Camera Rings for Samsung Galaxy S5 Active - Green","09/07/18 11:38 AM",0,1,0.99,4.64,3.49,0,"01/13/19 10:01 AM",etrade_supply,1.46,1.48
FLX-SAM-1504,"Rear Camera Rings for Samsung Galaxy S5 Active - Black","05/22/18 12:38 PM",0,5,0.79,4.64,3.49,0,"01/13/19 10:01 AM",etrade_supply,1.46,1.48
FLX-SAM-1506,"Charging Port Flex Cable for Samsung Galaxy S5 G900F","07/27/18 04:39 PM",2,7,3.39,12.99,0,4.49,"01/13/19 10:01 AM",etrade_supply,7.11,7.21
FLX-SAM-1545,"Charging Port for Samsung Galaxy Tab 3 8.0 SM T310 ","04/25/18 04:13 PM",2,2,1.99,8.49,0,2.49,"01/13/19 10:20 AM",etrade_supply,4.82,4.89
FLX-SAM-156,"Keypad Microphone Flex Cable for Samsung Galaxy S",N/A,0,4,0,7.95,5.59,0.99,"01/13/19 10:20 AM",etrade_supply,3.46,3.52
SRN-LGM-575,"LCD + Touch Screen Digitizer with Frame for LG Optimus G2 D800 D801 B29 - Black","02/06/18 10:39 AM",0,0,27.33,59.99,29.99,29.99,"01/13/19 10:20 AM",etrade_supply,35.62,36.16
SRN-LGM-580,"LG G4 Mini LCD Screen Touch Screen Assembly - Black",N/A,0,2,45.02,61.9,56.29,36.49,"01/13/19 10:20 AM",etrade_supply,22.28,22.62
SRN-LGM-585,"LG G Flex 2 LCD Display and Digitizer Assembly - Black","12/01/16 12:52 PM",0,0,56.42,76.17,69.49,0,"01/13/19 10:20 AM",etrade_supply,64.52,65.49
SRN-LGM-616,"LCD and Touch Screen Digitizer for LG G Vista D631 VS880","09/26/17 02:24 PM",0,0,32.2,49.91,45.38,0,"01/13/19 10:20 AM",etrade_supply,62.34,63.29
SRN-LGM-618,"LCD and Touch Screen Digitizer Replacement for LG Lucid 2 - Black",N/A,0,0,0,69.95,0,0,"01/13/19 10:20 AM",etrade_supply,58.38,59.26
SRN-LGM-636,"LG Optimus G Pro E980 LCD Screen","10/12/16 09:38 AM",0,1,12.86,19.93,17.69,16.99,"01/13/19 10:20 AM",etrade_supply,14.43,14.65
SRN-LGM-637,"LCD and Touch Screen Digitizer With Frame for LG G5 - Black","12/04/18 03:51 PM",0,9,33.94,84.99,44.39,44.39,"01/13/19 10:20 AM",etrade_supply,33.81,34.32
SRN-LGM-638,"LCD and Digitizer Replacement with Frame for LG Nexus 5X","12/14/18 04:42 PM",1,3,24.48,40.95,40.95,21.89,"01/13/19 10:40 AM",etrade_supply,131.01,132.99
SRN-LGM-639,"LCD and Digitizer Replacement with Frame for LG Nexus 4",N/A,0,0,0,44.99,0,26.99,"01/13/19 10:40 AM",etrade_supply,29.15,29.59
SRN-LGM-644,"LCD and Digitizer Replacement with Frame for LG G2 VS980 - White",N/A,0,0,0,59.99,0,30.89,"01/13/19 10:40 AM",etrade_supply,42.28,42.92
SRN-LGM-647,"LG Optimus G Pro E980 LCD Assembly with Frame - Black","05/30/17 03:57 PM",0,0,28.15,37.3,34.69,0,"01/13/19 10:40 AM",etrade_supply,67.23,68.24
SRN-LGM-648,"LCD and Touch Screen Replacement with Frame for LG V20 - Black","09/24/18 12:21 PM",4,1,59.73,99.99,99.99,35.99,"01/13/19 10:40 AM",etrade_supply,57.89,58.76
FLX-LGM-634,"Loudspeaker Module for LG G6","08/15/18 12:53 PM",0,6,2.42,24,0,5.99,"01/13/19 10:41 AM",mobile_defenders,5.49,4.99
FLX-LGM-632,"Rear Camera for LG G6 H870 H871 H872 H873","10/11/18 09:47 AM",0,2,10.36,35,0,16.49,"01/13/19 10:41 AM",mobile_defenders,13.99,11.99
FLX-SAM-788,"Charging Port Flex Cable for Samsung Galaxy Note 3 N900P ","07/27/18 04:39 PM",0,3,2.34,8.075,6.89,4.49,"01/13/19 11:00 AM",etrade_supply,6.51,6.61
SRN-HTC-144,"HTC Evo 4G LTE LCD Screen + Digitzer Touch Screen - White","02/29/16 01:35 PM",0,2,17.34,24.77,22.79,16.99,"01/13/19 11:00 AM",etrade_supply,42.3,42.94
SRN-HTC-150,"HTC Evo 4G LTE LCD Screen",N/A,0,3,0,30.95,23.79,14.99,"01/13/19 11:00 AM",etrade_supply,16.78,17.04
SRN-HTC-156,"HTC Evo 4G LTE Touch Screen Digitizer","03/14/16 12:54 PM",0,3,6.44,11.27,9.49,6.99,"01/13/19 11:00 AM",etrade_supply,11.51,11.68
SRN-HTC-186,"HTC G2 / Desire Z LCD Screen","11/30/15 01:14 PM",0,4,7.12,13.96,11.29,13.99,"01/13/19 11:00 AM",etrade_supply,22.76,23.1
SRN-HTC-198,"HTC G2 / Desire Z Touch Screen Digitizer","11/30/15 01:14 PM",0,4,5.04,9.07,7.89,7.99,"01/13/19 11:00 AM",etrade_supply,7.21,7.32
SRN-HTC-240,"HTC Inspire / Desire HD LCD + Touch Screen Digitizer","06/24/15 12:11 PM",0,3,16.76,24.302,22.29,20.99,"01/13/19 11:00 AM",etrade_supply,17.95,18.22
SRN-HTC-318,"HTC One V Front Housing LCD + Touch Screen Digitizer",N/A,0,5,0,29.95,26.69,8.99,"01/13/19 11:01 AM",etrade_supply,19.14,19.44
SRN-HTC-324,"HTC One X Front Housing LCD + Touch Screen Digitizer","01/21/16 04:33 PM",0,1,19.39,28.12,25.79,19.99,"01/13/19 11:01 AM",etrade_supply,26.77,27.17
SRN-HTC-330,"HTC Radar 4G LCD Screen","11/08/18 11:09 AM",0,8,8.89,15.113,12.19,14.49,"01/13/19 11:01 AM",etrade_supply,13.08,13.28
SRN-HTC-336,"HTC Radar 4G Touch Screen Digitizer",N/A,0,8,0,8.95,8.89,10.99,"01/13/19 11:20 AM",etrade_supply,14.43,14.65
SRN-HTC-342,"HTC Rezound LCD Screen",N/A,0,3,0,28.95,17.79,15.95,"01/13/19 11:20 AM",etrade_supply,25.11,25.49
SRN-HTC-348,"HTC Rezound Touch Screen Digitizer",N/A,0,6,0,11.95,6.89,14.49,"01/13/19 11:20 AM",etrade_supply,7.21,7.32
SRN-HTC-354,"HTC Rhyme Touch Screen Digitizer",N/A,0,8,0,10.95,10.89,7.59,"01/13/19 11:20 AM",etrade_supply,8.65,8.79
SRN-HTC-360,"HTC Sensation LCD + Touch Screen Digitizer",N/A,0,14,0,30.95,26.69,8.99,"01/13/19 11:20 AM",etrade_supply,29.92,30.38
SRN-HTC-378,"HTC Sensation Touch Screen Digitizer",N/A,0,2,0,14.95,9.89,5.99,"01/13/19 11:20 AM",etrade_supply,10.02,10.18
SRN-HTC-384,"HTC Sensation XL LCD + Touch Screen Digitizer - White",N/A,0,5,0,42.95,26.69,28.49,"01/13/19 11:20 AM",etrade_supply,23.93,24.29
SRN-HTC-396,"HTC Status Touch Screen Digitizer",N/A,0,7,0,7.95,7.89,5.99,"01/13/19 11:20 AM",etrade_supply,4.36,4.42
SRN-HTC-414,"HTC Thunderbolt LCD Screen",N/A,0,19,0,17.95,15.79,4.99,"01/13/19 11:20 AM",etrade_supply,16.78,17.04
SRN-HTC-426,"HTC Thunderbolt Touch Screen Digitizer",N/A,0,4,0,8.95,7.89,4.99,"01/13/19 11:20 AM",etrade_supply,14.43,14.65
SRN-HTC-432,"HTC Titan 2 Touch Screen Digitizer - Black",N/A,0,3,0,14.95,10.89,4.99,"01/13/19 11:20 AM",etrade_supply,15.56,15.8
SRN-HTC-438,"HTC Titan Touch Screen Digitizer",N/A,0,10,0,12.95,11.89,4.99,"01/13/19 11:20 AM",etrade_supply,15.56,15.8
SRN-HTC-444,"HTC Trophy LCD Screen",N/A,0,8,0,13.95,13.89,4.99,"01/13/19 11:20 AM",etrade_supply,16.78,17.04
SRN-HTC-450,"HTC Trophy LCD + Touch Screen Digitizer","03/11/15 12:05 PM",0,2,17.14,24.853,22.89,4.99,"01/13/19 11:20 AM",etrade_supply,51.21,51.98
SRN-HTC-456,"HTC Trophy Touch Screen Digitizer",N/A,0,13,0,10.95,10.89,8.99,"01/13/19 11:21 AM",etrade_supply,8.65,8.79
SRN-HTC-462,"HTC Vivid LCD Screen",N/A,0,28,0,19.95,15.79,42.99,"01/13/19 11:21 AM",etrade_supply,21.55,21.87
SRN-HTC-468,"HTC Vivid LCD + Touch Screen Digitizer - Black",N/A,0,8,0,28.95,28.69,57.99,"01/13/19 11:21 AM",etrade_supply,24.92,25.29
SRN-HTC-474,"HTC Vivid LCD + Touch Screen Digitizer - White","04/20/15 11:11 AM",0,12,21.21,29.694,27.59,57.99,"01/13/19 11:21 AM",etrade_supply,24.51,24.88
SRN-HTC-480,"HTC Vivid Touch Screen Digitizer - Black","04/20/15 12:22 PM",0,5,5.63,10.134,8.79,14.99,"01/13/19 11:21 AM",etrade_supply,10.13,10.29
SRN-HTC-486,"HTC Vivid Touch Screen Digitizer - White",N/A,0,13,0,9.95,7.89,14.99,"01/13/19 11:40 AM",etrade_supply,10.13,10.29
SRN-HTC-498,"HTC Wildfire S LCD Screen",N/A,0,9,0,7.95,7.89,12.49,"01/13/19 11:40 AM",etrade_supply,10.13,10.29
SRN-HTC-528,"HTC Windows 8x Digitizer Touch Screen","12/04/15 04:09 PM",0,1,5.75,10.35,8.99,8.99,"01/13/19 11:40 AM",etrade_supply,10.13,10.29
SRN-HTC-534,"HTC Windows 8x LCD Screen",N/A,0,5,0,28.95,16.79,14.99,"01/13/19 11:40 AM",etrade_supply,14.43,14.65
SRN-HTC-540,"HTC Windows 8x LCD Screen Touch Screen Digitizer Assembly","03/07/16 12:28 PM",0,5,17.4,26.78,24.59,20.99,"01/13/19 11:40 AM",etrade_supply,24.91,25.28
SRN-HTC-546,"HTC Windows Phone 8S LCD Digitizer Assembly - Blue",N/A,0,0,0,36.95,22.79,0,"01/13/19 11:40 AM",etrade_supply,15.55,15.79
SRN-HTC-550,"HTC One M7 LCD + Touch Screen Digitizer","03/06/18 02:23 PM",0,16,11.39,30.72,28.59,19.49,"01/13/19 11:40 AM",etrade_supply,19.14,19.44
SRN-HTC-554,"HTC Verizon Droid DNA LCD + Touch Screen Digitizer","09/25/17 03:22 PM",0,3,16.74,26.61,24.41,27.49,"01/13/19 11:40 AM",etrade_supply,26.88,27.29
SRN-HTC-582,"LCD and Touch Screen Digitizer for HTC One M8 - Black","11/20/18 12:12 PM",0,3,14.28,47.7125,16.99,16.99,"01/13/19 11:40 AM",etrade_supply,21.54,21.86
SRN-HTC-584,"HTC One Max LCD Screen and Digitizer Assembly HTC Logo Black","11/21/17 04:43 PM",0,1,21.33,41.15,38.29,29.99,"01/13/19 11:40 AM",etrade_supply,33.54,34.05
SRN-HTC-586,"HTC One Max Touch Screen Digitizer HTC Logo Black","07/19/16 01:31 PM",0,1,8.44,14.86,11.99,39.49,"01/13/19 11:40 AM",etrade_supply,13.01,13.21
SRN-HTC-588,"HTC One Max LCD Screen","05/19/15 02:15 PM",0,1,25.92,36.288,33.79,9.99,"01/13/19 11:40 AM",etrade_supply,26.75,27.15
SRN-HTC-606,"HTC Trophy LCD and Touch Screen Digitizer with Frame",N/A,0,2,0,38.95,0,7.99,"01/13/19 11:40 AM",etrade_supply,44.52,45.19
SRN-HTC-650,"LCD + Touch Screen Digitizer for HTC Desire 600 601 Zara Black",N/A,0,5,0,52.95,48.49,28.99,"01/13/19 11:41 AM",etrade_supply,21.52,21.84
SRN-HTC-652,"LCD + Touch Screen Digitizer with Frame for HTC One M7 801e Black","01/17/17 01:21 PM",0,3,21.65,30.31,28.15,16.99,"01/13/19 11:41 AM",etrade_supply,23.37,23.73
SRN-HTC-658,"LCD + Touch Screen Digitizer with Frame for HTC One M8 831C","08/15/18 12:53 PM",1,5,16.56,31.99,31.99,19.79,"01/13/19 12:00 PM",etrade_supply,33.4,33.9
SRN-HTC-908,"HTC One X LCD + Touch Screen Digitizer with Frame","06/10/16 12:22 PM",0,1,21.66,30.32,28.19,20.99,"01/13/19 12:00 PM",etrade_supply,26.77,27.17
SRN-LGM-138,"LG L9 P760 International Version Digitizer Touch Screen - Black",N/A,0,5,0,16.95,7.89,6.99,"01/13/19 12:00 PM",etrade_supply,8.65,8.79
SRN-LGM-146,"LG L9 P760 International Version Digitizer Touch Screen - White",N/A,0,7,0,17.95,7.89,6.99,"01/13/19 12:00 PM",etrade_supply,8.83,8.97
SRN-LGM-160,"LG Optimus L9 P769 Touch Screen Digitizer","01/26/16 03:02 PM",0,2,6.26,9.025,7.69,12.49,"01/13/19 12:00 PM",etrade_supply,8.65,8.79
SRN-LGM-166,"LG Mach LS860 Touch Screen Digitizer - Black",N/A,0,2,0,23.95,15.79,9.49,"01/13/19 12:00 PM",etrade_supply,12.58,12.78
SRN-LGM-264,"LG Intuition VS950 LCD Screen",N/A,0,0,0,18.95,0,0,"01/13/19 12:00 PM",etrade_supply,23.93,24.29
SRN-LGM-296,"LCD and Touch Screen Digitizer for LG Optimus G2 D802 D805 - Black","03/09/18 04:11 PM",0,10,29.5,59.99,37.99,37.99,"01/13/19 12:00 PM",etrade_supply,28.94,29.38
SRN-LGM-362,"LCD + Touch Screen Digitizer with Frame for LG Google Nexus 5 D820 D821 Black","09/24/18 12:21 PM",0,7,19.04,34.72,34.72,21.89,"01/13/19 12:01 PM",etrade_supply,33.32,33.82
SRN-LGM-550,"LG Optimus L90 D405 D415 Touch Screen Digitizer","03/03/16 01:11 PM",0,0,5.84,9.33,7.89,4.99,"01/13/19 12:01 PM",etrade_supply,10.88,11.04
SRN-LGM-558,"LG Galaxy Nexus 4 E960 Back Housing Glass without Frame",N/A,0,0,0,8.95,8.89,0,"01/13/19 12:20 PM",etrade_supply,11.74,11.92
APL-001-2225,"LCD Backlight Film for iPhone 6 - Standard ","05/23/16 12:11 PM",0,17,3.42,5.99,0,1.99,"01/13/19 12:20 PM",maya_cellular,0,1.99
BTY-COV-1693,"Rear Battery Cover for Samsung Galaxy S7 - White","10/30/17 03:35 PM",0,13,3.81,8.99,8.6,4.99,"01/13/19 12:20 PM",maya_cellular,0,4.99
FLX-UCP-104,"HTC Windows 8X / Evo 4G LTE USB Charging Port",N/A,0,119,0,2.95,2.99,0.49,"01/13/19 12:20 PM",etrade_supply,0.74,0.75
FLX-UCP-124,"HTC Evo 4G LTE Charging Port","12/30/15 02:07 PM",0,0,0.97,2.43,2.09,0,"01/13/19 12:20 PM",etrade_supply,0.74,0.75
FLX-UCP-160,"ZTE Concord V768 Charging Port",N/A,0,0,0,2.95,0.69,0,"01/13/19 12:20 PM",etrade_supply,0.74,0.75
APL-003-1779,"Sim Card Tray for iPhone 7- Gold","08/24/18 10:50 AM",1,4,0.85,1.99,0,1.29,"01/13/19 12:20 PM",etrade_supply,1.2,1.22
APL-003-1779,"Sim Card Tray for iPhone 7- Gold","08/24/18 10:50 AM",1,4,0.85,1.99,0,1.29,"01/13/19 12:20 PM",maya_cellular,0,0.99
FLX-SAM-729,"Sim Card Memory SD Card Flex Cable for Samsung Galaxy S4 REV 1.3","11/15/17 03:07 PM",0,0,0.99,3.36,2.59,0.99,"01/13/19 12:20 PM",etrade_supply,2.52,2.56
FLX-SAM-731,"Headphone Ear Piece Audio Jack Speaker Flex Cable for Samsung Galaxy Note ",N/A,0,25,0,11.95,9.99,0.99,"01/13/19 12:21 PM",etrade_supply,1.04,1.05
FLX-SAM-733,"Front Camera for Samsung Galaxy S4",N/A,0,25,0.87,2.175,1.89,0.99,"01/13/19 12:21 PM",etrade_supply,1.71,1.74
FLX-SAM-736,"Sim Card Memory SD Card Flex Cable for Samsung Galaxy S4 REV 1.3 / 0.5","03/07/18 03:39 PM",0,5,1.19,2.54,1.96,0.99,"01/13/19 12:21 PM",etrade_supply,2.52,2.56
FLX-SAM-738,"Loudspeaker Buzzer for Samsung Galaxy S4 - White","02/20/17 11:36 AM",0,1,1.5,3.6,2.78,1.49,"01/13/19 12:40 PM",etrade_supply,1.74,1.77
FLX-SAM-739,"Samsung Galaxy Note 10.1 Tablet N8000 Headphone Audio Jack Flex Cable REV 0.3A",N/A,0,9,0,5.95,3.59,0.99,"01/13/19 12:40 PM",etrade_supply,3.49,3.55
FLX-SAM-742,"USB Charging Port Microphone Flex Cable for Samsung Galaxy S4 i9505  REV 19","05/04/17 12:56 PM",0,7,2.21,5.67,4.19,5.49,"01/13/19 12:40 PM",etrade_supply,3.87,3.93
FLX-SAM-750,"Vibrator Module for Samsung Galaxy S4",N/A,1,418,0,2.95,0,0.99,"01/13/19 12:40 PM",etrade_supply,0.85,0.86
FLX-SAM-754,"LCD Tester for Samsung Galaxy S3 ","01/17/17 02:58 PM",0,3,1.78,4.09,3.29,1.99,"01/13/19 12:40 PM",etrade_supply,3.16,3.2
FLX-SAM-756,"Charging Port Microphone Flex Cable for Samsung Galaxy S4 i337 M919 USB ","10/30/18 01:37 PM",1,5,1.9,5.99,5.99,2.29,"01/13/19 12:40 PM",etrade_supply,4.84,4.91
FLX-SAM-758,"USB Charging Port Microphone Flex Cable for Samsung Galaxy S4 L720 i545  REV 0.7","12/04/18 03:51 PM",0,7,1.53,6.7275,4.93,2.99,"01/13/19 12:40 PM",etrade_supply,2.65,2.69
FLX-SAM-772,"Stylus Flex Pen Writing Input for Samsung Galaxy Note 2","09/22/15 02:26 PM",0,16,2.37,6.53,5.19,0.99,"01/13/19 12:40 PM",etrade_supply,3.45,3.51
