SKU,Title,"Last Received","30 Days Item Sale",Quantity,"True Cost",D1,P1,"Sale Price","Date Updated",Competitor,"Previous Price",Price
FLX-SAM-1476,"Charging Port Flex Cable for Samsung Galaxy S5 G900F","12/04/18 03:51 PM",0,5,3.28,7.77,6.11,4.49,"12/08/18 06:40 AM",etrade_supply,8.01,8.07
FLX-SAM-1489,"Charging Port Flex Cable for Samsung Galaxy S5 G900H","08/24/17 02:40 PM",0,6,3.88,9.37,7.89,4.99,"12/08/18 07:00 AM",etrade_supply,7.07,7.12
SRN-LGM-677,"LCD and Touch Screen Digitizer with Frame for LG G3 - Gold","05/04/18 03:36 PM",0,1,36.16,59.2213,0,51.19,"12/08/18 07:00 AM",etrade_supply,33.15,33.4
SRN-LGM-681,"LG Optimus G LS970 LCD Screen Touch Screen Digitizer with Frame","12/19/17 03:54 PM",0,2,0,49.99,0,37.49,"12/08/18 07:00 AM",etrade_supply,46.41,46.76
SRN-MOT-422,"Motorola Moto G XT1032 XT1036 LCD Touch Screen Digitizer Assembly","08/22/16 10:30 AM",0,2,24,33.91,31.49,21.49,"12/08/18 07:00 AM",etrade_supply,24.5,24.68
SRN-MOT-426,"LCD Screen and Digitizer Assembly for Motorola Moto E XT1021 XT1022 No Logo Black","10/16/17 03:31 PM",0,1,14.93,20.99,16.09,16.09,"12/08/18 07:00 AM",etrade_supply,22.58,22.75
SRN-MOT-440,"LCD and Touch Screen Digitizer for Motorola Moto E XT1021 XT1022 XT1025 - White",N/A,0,9,0,20.99,0,16.09,"12/08/18 07:00 AM",etrade_supply,19,19.14
SRN-MOT-442,"LCD + Touch Screen Digitizer for Motorola Droid Mini XT1030 Black","03/20/18 03:49 PM",0,2,10.17,23.81,21.89,14.69,"12/08/18 07:00 AM",etrade_supply,28.75,28.96
SRN-MOT-456,"LCD + Touch Screen Digitizer with Frame for Motorola Droid Razr M XT907 Black","02/26/16 11:30 AM",0,0,18.02,26.13,23.99,0,"12/08/18 07:01 AM",etrade_supply,23.75,23.93
FLX-SAM-1492,"Charging Port for Samsung Galaxy Tab Pro 8.4 T320 ","06/13/18 01:48 PM",0,5,1.67,4.91,3.69,2.49,"12/08/18 07:01 AM",etrade_supply,3.44,3.47
FLX-SAM-1503,"Rear Camera Rings for Samsung Galaxy S5 Active - Green","09/07/18 11:38 AM",0,1,0.99,4.64,3.49,0,"12/08/18 07:01 AM",etrade_supply,1.45,1.46
FLX-SAM-1504,"Rear Camera Rings for Samsung Galaxy S5 Active - Black","05/22/18 12:38 PM",0,5,0.79,4.64,3.49,0,"12/08/18 07:01 AM",etrade_supply,1.45,1.46
FLX-SAM-1506,"Charging Port Flex Cable for Samsung Galaxy S5 G900F","07/27/18 04:39 PM",0,9,3.39,12.99,0,4.49,"12/08/18 07:01 AM",etrade_supply,8.01,8.07
FLX-SAM-1545,"Charging Port for Samsung Galaxy Tab 3 8.0 SM T310 ","04/25/18 04:13 PM",0,4,1.99,8.49,0,2.49,"12/08/18 07:20 AM",etrade_supply,4.78,4.82
FLX-SAM-156,"Keypad Microphone Flex Cable for Samsung Galaxy S",N/A,0,4,0,7.95,5.59,0.99,"12/08/18 07:20 AM",etrade_supply,3.43,3.46
SRN-LGM-575,"LCD + Touch Screen Digitizer with Frame for LG Optimus G2 D800 D801 B29 - Black","02/06/18 10:39 AM",0,0,27.33,59.99,29.99,29.99,"12/08/18 07:20 AM",etrade_supply,35.36,35.62
SRN-LGM-580,"LG G4 Mini LCD Screen Touch Screen Assembly - Black",N/A,0,2,45.02,61.9,56.29,36.49,"12/08/18 07:20 AM",etrade_supply,22.11,22.28
SRN-LGM-585,"LG G Flex 2 LCD Display and Digitizer Assembly - Black","12/01/16 12:52 PM",0,0,56.42,76.17,69.49,0,"12/08/18 07:20 AM",etrade_supply,64.04,64.52
SRN-LGM-616,"LCD and Touch Screen Digitizer for LG G Vista D631 VS880","09/26/17 02:24 PM",0,0,32.2,49.91,45.38,0,"12/08/18 07:20 AM",etrade_supply,61.88,62.34
SRN-LGM-618,"LCD and Touch Screen Digitizer Replacement for LG Lucid 2 - Black",N/A,0,0,0,69.95,0,0,"12/08/18 07:20 AM",etrade_supply,57.95,58.38
SRN-LGM-636,"LG Optimus G Pro E980 LCD Screen","10/12/16 09:38 AM",0,1,12.86,19.93,17.69,16.99,"12/08/18 07:40 AM",etrade_supply,14.32,14.43
SRN-LGM-637,"LCD and Touch Screen Digitizer With Frame for LG G5 - Black","12/04/18 03:51 PM",2,10,33.94,84.99,44.39,44.39,"12/08/18 07:40 AM",etrade_supply,33.56,33.81
SRN-LGM-638,"LCD and Digitizer Replacement with Frame for LG Nexus 5X","09/24/18 12:21 PM",3,1,17.81,40.95,40.95,21.89,"12/08/18 07:40 AM",etrade_supply,130.04,131.01
SRN-LGM-639,"LCD and Digitizer Replacement with Frame for LG Nexus 4",N/A,0,0,0,44.99,0,26.99,"12/08/18 07:40 AM",etrade_supply,28.93,29.15
SRN-LGM-644,"LCD and Digitizer Replacement with Frame for LG G2 VS980 - White",N/A,0,0,0,59.99,0,30.89,"12/08/18 07:40 AM",etrade_supply,41.97,42.28
SRN-LGM-647,"LG Optimus G Pro E980 LCD Assembly with Frame - Black","05/30/17 03:57 PM",0,0,28.15,37.3,34.69,0,"12/08/18 07:40 AM",etrade_supply,66.73,67.23
SRN-LGM-648,"LCD and Touch Screen Replacement with Frame for LG V20 - Black","09/24/18 12:21 PM",1,5,59.73,99.99,99.99,35.99,"12/08/18 07:40 AM",etrade_supply,68.32,68.83
FLX-LGM-633,"Earpiece Speake for LG G6","06/23/17 04:35 PM",0,3,1.04,9,0,1.99,"12/08/18 07:40 AM",mobile_defenders,1.49,0.99
FLX-SAM-788,"Charging Port Flex Cable for Samsung Galaxy Note 3 N900P ","07/27/18 04:39 PM",1,3,2.34,8.075,6.89,4.49,"12/08/18 08:00 AM",etrade_supply,6.46,6.51
SRN-HTC-144,"HTC Evo 4G LTE LCD Screen + Digitzer Touch Screen - White","02/29/16 01:35 PM",0,2,17.34,24.77,22.79,16.99,"12/08/18 08:00 AM",etrade_supply,41.99,42.3
SRN-HTC-150,"HTC Evo 4G LTE LCD Screen",N/A,0,3,0,30.95,23.79,14.99,"12/08/18 08:00 AM",etrade_supply,16.66,16.78
SRN-HTC-156,"HTC Evo 4G LTE Touch Screen Digitizer","03/14/16 12:54 PM",0,3,6.44,11.27,9.49,6.99,"12/08/18 08:00 AM",etrade_supply,11.42,11.51
SRN-HTC-186,"HTC G2 / Desire Z LCD Screen","11/30/15 01:14 PM",0,4,7.12,13.96,11.29,13.99,"12/08/18 08:00 AM",etrade_supply,22.59,22.76
SRN-HTC-198,"HTC G2 / Desire Z Touch Screen Digitizer","11/30/15 01:14 PM",0,4,5.04,9.07,7.89,7.99,"12/08/18 08:00 AM",etrade_supply,7.16,7.21
SRN-HTC-240,"HTC Inspire / Desire HD LCD + Touch Screen Digitizer","06/24/15 12:11 PM",0,3,16.76,24.302,22.29,20.99,"12/08/18 08:01 AM",etrade_supply,17.82,17.95
SRN-HTC-318,"HTC One V Front Housing LCD + Touch Screen Digitizer",N/A,0,6,0,29.95,26.69,8.99,"12/08/18 08:01 AM",etrade_supply,19,19.14
SRN-HTC-324,"HTC One X Front Housing LCD + Touch Screen Digitizer","01/21/16 04:33 PM",0,1,19.39,28.12,25.79,19.99,"12/08/18 08:01 AM",etrade_supply,26.57,26.77
SRN-HTC-330,"HTC Radar 4G LCD Screen","11/08/18 11:09 AM",0,8,8.89,15.113,12.19,14.49,"12/08/18 08:20 AM",etrade_supply,12.98,13.08
SRN-HTC-336,"HTC Radar 4G Touch Screen Digitizer",N/A,0,8,0,8.95,8.89,10.99,"12/08/18 08:20 AM",etrade_supply,14.32,14.43
SRN-HTC-342,"HTC Rezound LCD Screen",N/A,0,3,0,28.95,17.79,15.95,"12/08/18 08:20 AM",etrade_supply,24.92,25.11
SRN-HTC-348,"HTC Rezound Touch Screen Digitizer",N/A,0,6,0,11.95,6.89,14.49,"12/08/18 08:20 AM",etrade_supply,7.16,7.21
SRN-HTC-354,"HTC Rhyme Touch Screen Digitizer",N/A,0,9,0,10.95,10.89,7.59,"12/08/18 08:20 AM",etrade_supply,8.59,8.65
SRN-HTC-360,"HTC Sensation LCD + Touch Screen Digitizer",N/A,0,14,0,30.95,26.69,8.99,"12/08/18 08:20 AM",etrade_supply,29.7,29.92
SRN-HTC-378,"HTC Sensation Touch Screen Digitizer",N/A,0,2,0,14.95,9.89,5.99,"12/08/18 08:20 AM",etrade_supply,9.95,10.02
SRN-HTC-384,"HTC Sensation XL LCD + Touch Screen Digitizer - White",N/A,0,5,0,42.95,26.69,28.49,"12/08/18 08:20 AM",etrade_supply,23.75,23.93
SRN-HTC-396,"HTC Status Touch Screen Digitizer",N/A,0,8,0,7.95,7.89,5.99,"12/08/18 08:20 AM",etrade_supply,4.33,4.36
SRN-HTC-414,"HTC Thunderbolt LCD Screen",N/A,0,18,0,17.95,15.79,4.99,"12/08/18 08:20 AM",etrade_supply,16.66,16.78
SRN-HTC-426,"HTC Thunderbolt Touch Screen Digitizer",N/A,0,4,0,8.95,7.89,4.99,"12/08/18 08:20 AM",etrade_supply,14.32,14.43
SRN-HTC-432,"HTC Titan 2 Touch Screen Digitizer - Black",N/A,0,3,0,14.95,10.89,4.99,"12/08/18 08:20 AM",etrade_supply,15.44,15.56
SRN-HTC-438,"HTC Titan Touch Screen Digitizer",N/A,0,10,0,12.95,11.89,4.99,"12/08/18 08:20 AM",etrade_supply,15.44,15.56
SRN-HTC-444,"HTC Trophy LCD Screen",N/A,0,8,0,13.95,13.89,4.99,"12/08/18 08:20 AM",etrade_supply,16.66,16.78
SRN-HTC-450,"HTC Trophy LCD + Touch Screen Digitizer","03/11/15 12:05 PM",0,2,17.14,24.853,22.89,4.99,"12/08/18 08:20 AM",etrade_supply,50.83,51.21
SRN-HTC-456,"HTC Trophy Touch Screen Digitizer",N/A,0,12,0,10.95,10.89,8.99,"12/08/18 08:21 AM",etrade_supply,8.59,8.65
SRN-HTC-462,"HTC Vivid LCD Screen",N/A,0,28,0,19.95,15.79,42.99,"12/08/18 08:21 AM",etrade_supply,21.39,21.55
SRN-HTC-468,"HTC Vivid LCD + Touch Screen Digitizer - Black",N/A,0,8,0,28.95,28.69,57.99,"12/08/18 08:21 AM",etrade_supply,24.74,24.92
SRN-HTC-474,"HTC Vivid LCD + Touch Screen Digitizer - White","04/20/15 11:11 AM",0,17,21.21,29.694,27.59,57.99,"12/08/18 08:40 AM",etrade_supply,24.33,24.51
SRN-HTC-480,"HTC Vivid Touch Screen Digitizer - Black","04/20/15 12:22 PM",0,5,5.63,10.134,8.79,14.99,"12/08/18 08:40 AM",etrade_supply,10.05,10.13
SRN-HTC-486,"HTC Vivid Touch Screen Digitizer - White",N/A,0,13,0,9.95,7.89,14.99,"12/08/18 08:40 AM",etrade_supply,10.05,10.13
SRN-HTC-498,"HTC Wildfire S LCD Screen",N/A,0,8,0,7.95,7.89,12.49,"12/08/18 08:40 AM",etrade_supply,10.05,10.13
SRN-HTC-528,"HTC Windows 8x Digitizer Touch Screen","12/04/15 04:09 PM",0,1,5.75,10.35,8.99,8.99,"12/08/18 08:40 AM",etrade_supply,10.05,10.13
SRN-HTC-534,"HTC Windows 8x LCD Screen",N/A,0,5,0,28.95,16.79,14.99,"12/08/18 08:40 AM",etrade_supply,14.32,14.43
SRN-HTC-540,"HTC Windows 8x LCD Screen Touch Screen Digitizer Assembly","03/07/16 12:28 PM",0,5,17.4,26.78,24.59,20.99,"12/08/18 08:40 AM",etrade_supply,24.73,24.91
SRN-HTC-546,"HTC Windows Phone 8S LCD Digitizer Assembly - Blue",N/A,0,0,0,36.95,22.79,0,"12/08/18 08:40 AM",etrade_supply,15.43,15.55
SRN-HTC-550,"HTC One M7 LCD + Touch Screen Digitizer","03/06/18 02:23 PM",0,17,11.39,30.72,28.59,19.49,"12/08/18 08:40 AM",etrade_supply,19,19.14
SRN-HTC-554,"HTC Verizon Droid DNA LCD + Touch Screen Digitizer","09/25/17 03:22 PM",0,3,16.74,26.61,24.41,27.49,"12/08/18 08:40 AM",etrade_supply,26.68,26.88
SRN-HTC-582,"LCD and Touch Screen Digitizer for HTC One M8 - Black","11/20/18 12:12 PM",0,3,14.28,47.7125,16.99,16.99,"12/08/18 08:40 AM",etrade_supply,21.38,21.54
SRN-HTC-584,"HTC One Max LCD Screen and Digitizer Assembly HTC Logo Black","11/21/17 04:43 PM",0,1,21.33,41.15,38.29,29.99,"12/08/18 08:40 AM",etrade_supply,33.29,33.54
SRN-HTC-586,"HTC One Max Touch Screen Digitizer HTC Logo Black","07/19/16 01:31 PM",0,1,8.44,14.86,11.99,39.49,"12/08/18 08:40 AM",etrade_supply,12.91,13.01
SRN-HTC-588,"HTC One Max LCD Screen","05/19/15 02:15 PM",0,1,25.92,36.288,33.79,9.99,"12/08/18 08:40 AM",etrade_supply,26.55,26.75
SRN-HTC-606,"HTC Trophy LCD and Touch Screen Digitizer with Frame",N/A,0,2,0,38.95,0,7.99,"12/08/18 08:40 AM",etrade_supply,44.19,44.52
SRN-HTC-650,"LCD + Touch Screen Digitizer for HTC Desire 600 601 Zara Black",N/A,0,5,0,52.95,48.49,28.99,"12/08/18 08:41 AM",etrade_supply,21.36,21.52
SRN-HTC-652,"LCD + Touch Screen Digitizer with Frame for HTC One M7 801e Black","01/17/17 01:21 PM",0,3,21.65,30.31,28.15,16.99,"12/08/18 08:41 AM",etrade_supply,23.2,23.37
SRN-HTC-658,"LCD + Touch Screen Digitizer with Frame for HTC One M8 831C","08/15/18 12:53 PM",0,6,16.56,31.99,31.99,19.79,"12/08/18 09:00 AM",etrade_supply,33.15,33.4
SRN-HTC-908,"HTC One X LCD + Touch Screen Digitizer with Frame","06/10/16 12:22 PM",0,1,21.66,30.32,28.19,20.99,"12/08/18 09:00 AM",etrade_supply,26.57,26.77
SRN-LGM-138,"LG L9 P760 International Version Digitizer Touch Screen - Black",N/A,0,5,0,16.95,7.89,6.99,"12/08/18 09:00 AM",etrade_supply,8.59,8.65
SRN-LGM-146,"LG L9 P760 International Version Digitizer Touch Screen - White",N/A,0,8,0,17.95,7.89,6.99,"12/08/18 09:00 AM",etrade_supply,8.76,8.83
SRN-LGM-160,"LG Optimus L9 P769 Touch Screen Digitizer","01/26/16 03:02 PM",0,2,6.26,9.025,7.69,12.49,"12/08/18 09:00 AM",etrade_supply,8.59,8.65
SRN-LGM-166,"LG Mach LS860 Touch Screen Digitizer - Black",N/A,0,2,0,23.95,15.79,9.49,"12/08/18 09:00 AM",etrade_supply,12.49,12.58
SRN-LGM-264,"LG Intuition VS950 LCD Screen",N/A,0,0,0,18.95,0,0,"12/08/18 09:00 AM",etrade_supply,23.75,23.93
SRN-LGM-296,"LCD and Touch Screen Digitizer for LG Optimus G2 D802 D805 - Black","03/09/18 04:11 PM",0,9,29.5,59.99,37.99,37.99,"12/08/18 09:00 AM",etrade_supply,28.73,28.94
SRN-LGM-362,"LCD + Touch Screen Digitizer with Frame for LG Google Nexus 5 D820 D821 Black","09/24/18 12:21 PM",0,7,19.04,34.72,34.72,21.89,"12/08/18 09:01 AM",etrade_supply,33.07,33.32
SRN-LGM-550,"LG Optimus L90 D405 D415 Touch Screen Digitizer","03/03/16 01:11 PM",0,0,5.84,9.33,7.89,4.99,"12/08/18 09:20 AM",etrade_supply,10.8,10.88
SRN-LGM-558,"LG Galaxy Nexus 4 E960 Back Housing Glass without Frame",N/A,0,0,0,8.95,8.89,0,"12/08/18 09:20 AM",etrade_supply,11.65,11.74
FLX-UCP-104,"HTC Windows 8X / Evo 4G LTE USB Charging Port",N/A,0,119,0,2.95,2.99,0.49,"12/08/18 09:20 AM",etrade_supply,0.73,0.74
FLX-UCP-124,"HTC Evo 4G LTE Charging Port","12/30/15 02:07 PM",0,0,0.97,2.43,2.09,0,"12/08/18 09:20 AM",etrade_supply,0.73,0.74
FLX-UCP-160,"ZTE Concord V768 Charging Port",N/A,0,0,0,2.95,0.69,0,"12/08/18 09:20 AM",etrade_supply,0.73,0.74
APL-003-1779,"Sim Card Tray for iPhone 7- Gold","08/24/18 10:50 AM",2,5,0.85,1.99,0,1.29,"12/08/18 09:20 AM",etrade_supply,1.19,1.2
FLX-SAM-729,"Sim Card Memory SD Card Flex Cable for Samsung Galaxy S4 REV 1.3","11/15/17 03:07 PM",0,1,0.99,3.36,2.59,0.99,"12/08/18 09:21 AM",etrade_supply,2.5,2.52
FLX-SAM-731,"Headphone Ear Piece Audio Jack Speaker Flex Cable for Samsung Galaxy Note ",N/A,0,25,0,11.95,9.99,0.99,"12/08/18 09:21 AM",etrade_supply,1.03,1.04
FLX-SAM-733,"Front Camera for Samsung Galaxy S4",N/A,0,25,0.87,2.175,1.89,0.99,"12/08/18 09:21 AM",etrade_supply,1.7,1.71
FLX-SAM-736,"Sim Card Memory SD Card Flex Cable for Samsung Galaxy S4 REV 1.3 / 0.5","03/07/18 03:39 PM",0,5,1.19,2.54,1.96,0.99,"12/08/18 09:40 AM",etrade_supply,2.5,2.52
FLX-SAM-738,"Loudspeaker Buzzer for Samsung Galaxy S4 - White","02/20/17 11:36 AM",0,1,1.5,3.6,2.78,1.49,"12/08/18 09:40 AM",etrade_supply,1.73,1.74
FLX-SAM-739,"Samsung Galaxy Note 10.1 Tablet N8000 Headphone Audio Jack Flex Cable REV 0.3A",N/A,0,9,0,5.95,3.59,0.99,"12/08/18 09:40 AM",etrade_supply,3.46,3.49
FLX-SAM-742,"USB Charging Port Microphone Flex Cable for Samsung Galaxy S4 i9505  REV 19","05/04/17 12:56 PM",0,7,2.21,5.67,4.19,5.49,"12/08/18 09:40 AM",etrade_supply,3.84,3.87
FLX-SAM-750,"Vibrator Module for Samsung Galaxy S4",N/A,0,419,0,2.95,0,0.99,"12/08/18 09:40 AM",etrade_supply,0.84,0.85
FLX-SAM-754,"LCD Tester for Samsung Galaxy S3 ","01/17/17 02:58 PM",0,3,1.78,4.09,3.29,1.99,"12/08/18 09:40 AM",etrade_supply,3.14,3.16
FLX-SAM-756,"Charging Port Microphone Flex Cable for Samsung Galaxy S4 i337 M919 USB ","10/30/18 01:37 PM",5,6,1.9,5.99,5.99,2.29,"12/08/18 09:40 AM",etrade_supply,4.8,4.84
FLX-SAM-758,"USB Charging Port Microphone Flex Cable for Samsung Galaxy S4 L720 i545  REV 0.7","12/04/18 03:51 PM",1,7,1.53,6.7275,4.93,2.99,"12/08/18 09:40 AM",etrade_supply,2.63,2.65
FLX-SAM-772,"Stylus Flex Pen Writing Input for Samsung Galaxy Note 2","09/22/15 02:26 PM",0,16,2.37,6.53,5.19,0.99,"12/08/18 09:41 AM",etrade_supply,3.42,3.45
FLX-SAM-790,"Charging Port Flex Cable for Samsung Galaxy Note 3 N900T ","12/04/18 03:51 PM",5,3,2.26,8.037,6.79,4.69,"12/08/18 10:00 AM",etrade_supply,6.36,6.41
FLX-SAM-794,"Charging Port Flex Cable for Samsung Galaxy Note 3 N900V ","07/20/18 05:01 PM",0,2,3.19,8.17,8.17,4.29,"12/08/18 10:00 AM",etrade_supply,6.36,6.41
FLX-SAM-800,"Audio Headphone Jack Speaker Flex Cable for Samsung Galaxy Note 3 N9000 N900A ","08/15/18 12:53 PM",0,5,0.93,3.979,3.29,1.99,"12/08/18 10:00 AM",etrade_supply,1.72,1.73
FLX-SAM-810,"Charging Port Microphone Flex Cable for Samsung Galaxy S4 i9505 REV 25","03/07/18 03:39 PM",0,3,2.3,5.99,4.19,2.89,"12/08/18 10:00 AM",etrade_supply,3.84,3.87
FLX-SAM-812,"Samsung Galaxy Note 3 OEM Stylus Pen - Black","12/04/18 03:51 PM",1,2,2.55,5.63,4.19,0,"12/08/18 10:00 AM",etrade_supply,2.76,2.78
FLX-SAM-814,"Samsung Galaxy Note 3 OEM Stylus Pen - White","06/12/17 01:33 PM",0,10,3.24,7.83,6.19,0,"12/08/18 10:00 AM",etrade_supply,2.76,2.78
FLX-SAM-816,"LCD Touch Screen Tester Flex Cable for Samsung Galaxy Note 3 ","08/05/15 11:55 AM",0,14,2.31,5.1975,3.89,1.99,"12/08/18 10:00 AM",etrade_supply,3.01,3.03
FLX-SAM-944,"Home Button for Samsung Galaxy S4 - Purple",N/A,0,39,0,5.95,0,0,"12/08/18 10:20 AM",etrade_supply,1.21,1.22
FLX-SAM-948,"Home Button for Samsung Galaxy S4 - Brown",N/A,0,35,0,5.95,0,0,"12/08/18 10:20 AM",etrade_supply,1.21,1.22
FLX-SAM-958,"Back Camera Lens Cover for Samsung Galaxy Note 3 - Black","04/25/18 04:13 PM",0,3,0.79,2.1,1.79,1.99,"12/08/18 10:20 AM",etrade_supply,1.22,1.23
FLX-SAM-960,"Back Camera Lens Cover for Samsung Galaxy Note 3 - White","09/15/17 03:06 PM",0,8,1.2,2.1,1.79,1.99,"12/08/18 10:20 AM",etrade_supply,1.04,1.05
FLX-SAM-962,"Power Button Vibrator Flex for Samsung Galaxy Note 3","07/20/18 05:01 PM",0,4,0.91,3.41,2.69,1.49,"12/08/18 10:20 AM",etrade_supply,2.06,2.08
FLX-SAM-994,"Home Button Mic Charging Port Flex for Samsung Galaxy S5 SM G900V Verizon ","10/10/18 04:00 PM",7,10,2.5,7.33,7.33,4.49,"12/08/18 10:40 AM",etrade_supply,6.35,6.4
FLX-SNY-002,"Sony Xperia Z L36h Power Volume with Mic Flex","12/14/15 02:09 PM",0,3,1.93,4.44,3.59,1.99,"12/08/18 10:40 AM",etrade_supply,3.46,3.49
FLX-SNY-008,"Sony Xperia Z L36h Ear Piece Speaker","12/30/15 02:07 PM",0,1,0.97,2.275,1.99,1.99,"12/08/18 10:40 AM",etrade_supply,1,1.01
FLX-SNY-016,"Sony Xperia Z1 L39h NFC Antenna Coax Cables","04/13/16 01:49 PM",0,2,1.9,4.37,3.59,1.99,"12/08/18 10:41 AM",etrade_supply,1.02,1.03
FLX-SNY-018,"Sony Xperia Z1 L39h SIM Card Tray Black","07/22/16 01:08 PM",0,1,1.09,2.5,2.19,1.99,"12/08/18 10:41 AM",etrade_supply,1.35,1.36
FLX-SNY-020,"Sony Xperia Z1 L39h SIM Card Reader","01/26/16 01:44 PM",0,2,1.58,3.63,2.99,1.99,"12/08/18 10:41 AM",etrade_supply,3.08,3.1
FLX-SNY-026,"Sony Xperia Z1 L39h NFC Antenna","04/13/16 01:49 PM",0,2,0,3.99,0,1.99,"12/08/18 11:00 AM",etrade_supply,1.02,1.03
FLX-SAM-639,"SD Memory Card Flex for Samsung Galaxy Tab 10.1 P7500 ",N/A,0,2,0,7.95,5.39,0.99,"12/08/18 11:00 AM",etrade_supply,3.67,3.7
FLX-SAM-672,"Samsung Galaxy Tab 10.1 N8000 OEM S Pen Stylus - White / Silver","01/03/17 11:56 AM",0,3,4.39,8.27,6.5,0.99,"12/08/18 11:00 AM",etrade_supply,5.8,5.84
FLX-SAM-673,"Samsung Galaxy Note i717 OEM S Pen Stylus - White / Silver",N/A,0,11,0,21.95,19.99,0.99,"12/08/18 11:00 AM",etrade_supply,5.14,5.18
FLX-SAM-697,"Charging Port Flex Cable for Samsung Galaxy Note i9220 N7000  REV 1.6","05/27/16 02:02 PM",0,2,2.17,5.31,3.89,0.99,"12/08/18 11:00 AM",etrade_supply,3.18,3.2
FLX-SAM-702,"Loudspeaker Buzzer for Samsung Galaxy S4 - White (International)",N/A,0,9,0,14.95,12.99,0.99,"12/08/18 11:00 AM",etrade_supply,1.71,1.72
FLX-SAM-707,"Charging Port Microphone Flex Cable for Samsung Galaxy S4 i9500 USB ","05/22/18 12:38 PM",0,4,2.06,6.23,4.57,3.49,"12/08/18 11:00 AM",etrade_supply,4.8,4.84
FLX-SAM-717,"Home Button for Samsung Galaxy S3 - Red",N/A,0,11,0,2.95,0.99,0.99,"12/08/18 11:00 AM",etrade_supply,1.04,1.05
FLX-SAM-720,"Home Button for Samsung Galaxy S3 - Black","01/18/16 10:44 AM",0,8,0.73,1.85,1.59,0.59,"12/08/18 11:00 AM",etrade_supply,0.84,0.85
FLX-SAM-722,"Home Button for Samsung Galaxy S3 - Blue","01/31/17 03:33 PM",0,241,0,2.95,0.89,0.99,"12/08/18 11:01 AM",etrade_supply,0.85,0.86
FLX-SAM-724,"Samsung Galaxy Note 10.1 Tablet N8000 Charging Port Flex Cable REV 0.5","09/26/16 11:32 AM",0,0,2.78,6.0525,4.49,0.99,"12/08/18 11:01 AM",etrade_supply,4.82,4.86
FLX-SAM-725,"Samsung Galaxy Note 10.1 Tablet N8000 LCD Flex Cable","08/07/15 02:32 PM",0,15,1.78,4.094,3.29,0.99,"12/08/18 11:01 AM",etrade_supply,1.71,1.72
FLX-SAM-727,"Power Volume for Samsung Galaxy S3 - Red","01/05/16 02:21 PM",0,0,1.12,2.69,2.09,0.59,"12/08/18 11:01 AM",etrade_supply,1.24,1.25
SRN-LGM-692,"LCD and Touch Screen Digitizer for LG G6 - Black","01/12/18 02:18 PM",0,0,80.35,164.99,0,64.99,"12/08/18 11:20 AM",etrade_supply,58.16,58.59
SRN-LGM-693,"LCD and Touch Screen Digitizer for LG G6 - Silver","01/12/18 02:18 PM",0,0,80.35,164.99,0,64.49,"12/08/18 11:20 AM",etrade_supply,58.16,58.59
SRN-LGM-691,"LCD and Touch Screen Digitizer for LG G6 - White","11/21/17 04:43 PM",0,0,80.6,164.99,0,76.99,"12/08/18 11:20 AM",etrade_supply,55.24,55.65
FLX-SAM-796,"LCD Tester for Samsung Galaxy S4 ","07/03/17 12:08 PM",0,6,1.4,3.58,2.79,1.99,"12/08/18 11:21 AM",etrade_supply,2.5,2.52
FLX-SAM-710,"Headphone Audio Jack Flex Cable for Samsung Galaxy S4",N/A,0,137,0,10.95,8.99,0.99,"12/08/18 11:21 AM",etrade_supply,1.01,1.02
BTY-COV-1700,"Rear Battery Cover for Samsung Galaxy Note 5 - Black Sapphire (Standard)","05/31/18 12:28 PM",3,12,3.47,10.99,0,5.99,"12/08/18 11:40 AM",mobile_defenders,5.99,3.99
FLX-SAM-703,"Earpiece Speaker Proximity Sensor Flex Cable for Samsung Galaxy S4",N/A,0,167,0,3.95,0,1.49,"12/08/18 12:01 PM",etrade_supply,1.71,1.72
FLX-SAM-700,"Loudspeaker Flex Cable for Samsung Galaxy S3 - Red","01/27/17 03:31 PM",0,35,0,9.95,7.39,0.99,"12/08/18 12:01 PM",etrade_supply,1.71,1.72
SRN-SAM-1640,"LCD and Touch Screen Digitizer for Samsung Galaxy J3 (2016) - Black (Premium)","11/08/18 11:09 AM",2,0,38,79.99,0,48.89,"12/08/18 12:01 PM",etrade_supply,65.08,63.45
SRN-SAM-1641,"LCD and Touch Screen Digitizer for Samsung Galaxy J3 (2016) - White (Premium)","06/13/18 12:57 PM",0,0,39,79.99,0,48.89,"12/08/18 12:20 PM",etrade_supply,65.08,63.45
APL-003-1786,"LCD Tester Flex Cable for iPhone 7","07/05/18 04:13 PM",0,11,3.28,8.99,0,4.09,"12/08/18 12:20 PM",mobile_sentrix,3.17,3.15
APL-003-1785,"LCD Tester Flex Cable for iPhone 7 Plus","08/06/18 11:36 AM",0,8,3.06,9.99,0,3.99,"12/08/18 12:20 PM",mobile_sentrix,3.12,3.05
BTY-COV-1712,"Rear Battery Cover for Samsung Galaxy Note 5 - Gold (Standard)","07/20/18 05:01 PM",4,28,2.73,11.06,0,6.29,"12/08/18 12:40 PM",mobile_defenders,5.99,3.99
APL-002-6448,"LCD Frame for iPhone 8 Plus - White","03/23/18 03:25 PM",0,5,1.52,19.99,0,0,"12/08/18 12:40 PM",mobile_sentrix,12.01,0
APL-003-1788,"Charging Port Flex Cable for iPhone 8 Plus - Black","10/18/18 11:57 AM",6,1,4.31,34.99,34.99,18.99,"12/08/18 12:40 PM",mobile_sentrix,27.4,17.99
APL-003-1789,"Charging Port Flex Cable for iPhone 8 Plus - Gold","10/18/18 11:57 AM",7,8,4.31,34.99,34.99,18.99,"12/08/18 01:00 PM",mobile_defenders,8.99,6.99
FLX-SAM-1566,"Charging Port for Samsung Galaxy S6/S6 Edge","05/22/18 12:38 PM",0,10,0.55,1.99,0,0.89,"12/08/18 01:20 PM",mengtor,0,0.5
APL-003-1800,"Charging Port Flex Cable for iPhone 8 - Grey","10/18/18 11:57 AM",8,3,4.31,25.99,25.99,15.99,"12/08/18 01:20 PM",mengtor,10.99,10.5
APL-003-1800,"Charging Port Flex Cable for iPhone 8 - Grey","10/18/18 11:57 AM",8,3,4.31,25.99,25.99,15.99,"12/08/18 01:20 PM",mobile_defenders,8.99,6.99
APL-003-1813,"Power and Volume Button Flex Cable for iPhone 8 Plus","11/20/18 12:12 PM",2,6,7.71,25.99,0,9.99,"12/08/18 01:40 PM",mobile_defenders,8.99,5.99
APL-003-1812,"Front Camera Proximity Sensor Flex Cable for iPhone 8 Plus","11/14/18 04:45 PM",43,15,13.45,69.99,69.99,23.99,"12/08/18 01:40 PM",mobile_defenders,24.99,18.99
APL-003-1803,"Front Camera Proximity Sensor Flex Cable for iPhone 8","12/04/18 03:51 PM",25,14,8.39,34.99,28.99,17.59,"12/08/18 01:41 PM",mobile_defenders,19.99,15.99
APL-003-1805,"Power and Volume Button Flex Cable for iPhone 8","07/05/18 04:13 PM",0,5,4.06,22.99,0,14.99,"12/08/18 02:00 PM",mobile_defenders,10.99,5.99
FLX-SAM-1579,"Stylus Flex Cable Ribbon for Samsung Galaxy Note 8 N950F","04/17/18 02:12 PM",0,2,6.47,16.99,0,8.89,"12/08/18 02:21 PM",mengtor,7.99,0
FLX-SAM-1576,"Home Button Flex Cable for Samsung Galaxy Note 8 - Black","09/25/18 04:36 PM",1,5,8.27,22.99,22.99,11.29,"12/08/18 02:40 PM",mengtor,10.99,10.5
APL-003-1835,"Loudspeaker for iPhone X","09/25/18 04:36 PM",0,3,6.79,36.99,0,11.39,"12/08/18 03:00 PM",mobile_defenders,8.99,5.99
APL-003-1821,"Charging Port Flex Cable for iPhone X - Black ","07/05/18 04:13 PM",8,0,4.99,19.99,0,11.99,"12/08/18 03:20 PM",mengtor,10.99,10.8
BTY-COV-1719,"Rear Battery Cover for Samsung Galaxy S8 - Arctic Silver","10/26/18 04:47 PM",3,36,2.89,15.99,0,9.99,"12/08/18 03:20 PM",fixez,9.49,0
BTY-COV-1719,"Rear Battery Cover for Samsung Galaxy S8 - Arctic Silver","10/26/18 04:47 PM",3,36,2.89,15.99,0,9.99,"12/08/18 03:20 PM",mobile_defenders,5.99,3.99
BTY-COV-1720,"Rear Battery Cover for Samsung Galaxy S8 - Midnight Black","10/25/18 09:18 AM",14,30,2.49,15.99,0,9.99,"12/08/18 03:40 PM",mobile_defenders,5.99,3.99
BTY-COV-1721,"Rear Battery Cover for Samsung Galaxy S8 - Orchid Grey","07/20/18 05:01 PM",4,29,2.89,15.99,0,9.99,"12/08/18 03:40 PM",mobile_defenders,5.99,3.99
APL-003-1824,"Rear Camera Flex Cable for iPhone X","08/15/18 12:53 PM",0,3,58.23,169.99,0,68.29,"12/08/18 04:40 PM",mobile_defenders,79.99,74.99
APL-001-2398,"LCD and Touch Screen Digitizer for Apple Watch Series 2 38mm","08/24/18 10:50 AM",0,4,119.12,234.99,0,146.89,"12/08/18 05:00 PM",mobile_defenders,169.99,159.99
APL-001-2399,"LCD and Touch Screen Digitizer for Apple Watch Series 2 42mm","11/14/18 04:16 PM",1,2,120.15,199.99,0,157.49,"12/08/18 05:20 PM",mobile_defenders,169.99,159.99
APL-003-1827,"Power Flex Cable for iPhone X","08/06/18 11:36 AM",0,4,5.37,11.99,0,10.69,"12/08/18 05:20 PM",mobile_defenders,12.99,9.99
APL-003-1822,"Charging Port Flex Cable for iPhone X - Gray","08/06/18 11:36 AM",0,11,4.47,19.99,0,11.99,"12/08/18 05:21 PM",mobile_defenders,10.99,8.99
APL-003-1822,"Charging Port Flex Cable for iPhone X - Gray","08/06/18 11:36 AM",0,11,4.47,19.99,0,11.99,"12/08/18 05:40 PM",mengtor,10.99,10.8
APL-003-1841,"Home Button Flex Cable for iPad 5 (2017) - White","04/09/18 04:29 PM",0,2,4.19,7.11,0,6.99,"12/08/18 06:00 PM",mobile_defenders,4.49,3.99
APL-003-1842,"Home Button Flex Cable for iPad 5 (2017) - Black","05/08/18 03:18 PM",1,5,4.23,13.99,0,7.89,"12/08/18 06:00 PM",mobile_defenders,4.49,3.99
APL-003-1843,"Home Button Flex Cable for iPad 5 (2017) - Gold","05/31/18 01:10 PM",0,4,4.19,7.11,0,6.99,"12/08/18 06:00 PM",mobile_defenders,4.49,3.99
APL-003-1844,"Back Camera for iPad 5 (2017)","02/12/18 01:25 PM",0,2,4.25,8.11,0,0,"12/08/18 06:00 PM",mobile_defenders,6.99,4.99
APL-003-1845,"Power Button Flex Cable for iPad 5 (2017)","02/12/18 01:25 PM",0,2,1.53,3.99,0,2.09,"12/08/18 06:01 PM",mobile_defenders,2.49,1.99
APL-003-1849,"Home Button Flex Cable for iPad Pro 10.5 - Gold","05/15/18 10:50 AM",0,2,3.45,14.99,0,7.59,"12/08/18 06:20 PM",mobile_defenders,5.99,4.99
