"Date Updated",User,SKU,"Item Name","Price Type","Old Price","New Price"
"2018-12-14 12:24:14",Faheem,APL-003-1736,"Rear Camera for iPhone 7 Plus",Sale,$86.99,$89.99
"2018-12-14 12:25:17",Faheem,APL-003-1736,"Rear Camera for iPhone 7 Plus","Default 1",$150.99,$130.99
"2018-12-14 12:25:17",Faheem,APL-003-1736,"Rear Camera for iPhone 7 Plus","Platinum 1",$150.99,$130.99
"2018-12-14 16:47:01",Zahan,APL-001-2482,"LCD and Touch Screen Digitizer for iPhone X OLED - (Aftermarket Premium/Economy Plus)",Sale,$156.19,$154.99
"2018-12-14 16:48:20",Zahan,SRN-SAM-1635,"LCD and Touch Screen Digitizer for Samsung Galaxy S6 - Gold (Premium)",Sale,$107.59,$99.99
